"Implementing a Forms of Consent Smart Contract on an IoT-based Blockchain to promote user trust","C. S. Kouzinopoulos; K. M. Giannoutakis; K. Votis; D. Tzovaras; A. Collen; N. A. Nijdam; D. Konstantas; G. Spathoulas; P. Pandey; S. Katsikas","Centre for Research and Technology Hellas, Information Technologies Institute, Thessaloniki, Greece; Centre for Research and Technology Hellas, Information Technologies Institute, Thessaloniki, Greece; Centre for Research and Technology Hellas, Information Technologies Institute, Thessaloniki, Greece; Centre for Research and Technology Hellas, Information Technologies Institute, Thessaloniki, Greece; Centre Universitaire d’Informatique, University of Geneva, Geneva, Switzerland; Centre Universitaire d’Informatique, University of Geneva, Geneva, Switzerland; Centre Universitaire d’Informatique, University of Geneva, Geneva, Switzerland; Center for Cyber and Information Security, Norwegian University of Science and Technology, Gjøvik, Norway; Center for Cyber and Information Security, Norwegian University of Science and Technology, Gjøvik, Norway; Center for Cyber and Information Security, Norwegian University of Science and Technology, Gjøvik, Norway","2018 Innovations in Intelligent Systems and Applications (INISTA)","","2018","","","1","6","","","","10.1109/INISTA.2018.8466268","","https://ieeexplore.ieee.org/stamp/stamp.jsp?arnumber=8466268","blockchain;ethereum;smart contracts;cyber security;user trust","Smart homes;Contracts;Privacy;Protocols","computer network security;data privacy;electronic money;Internet of Things;trusted computing","GHOST project;consent smart contract;IoT-based blockchain;user trust;cyber-security layer;IoT smart home installations;IoT devices;distributed ledger network;digitally-signed transactions;sensitive user information;consent form;smart contracts;Forms of Consent application;H2020 European research project;Safe-Guarding Home IoT Environments with Personalised Real-time Risk Control","","","","","","","","","","IEEE","IEEE Conferences"
"Blockchain: Future of financial and cyber security","S. Singh; N. Singh","IBM Software Lab, Pune, India - 411 057; Tech Mahindra, Pune, India - 411 057","2016 2nd International Conference on Contemporary Computing and Informatics (IC3I)","","2016","","","463","467","","","","10.1109/IC3I.2016.7918009","","https://ieeexplore.ieee.org/stamp/stamp.jsp?arnumber=7918009","Blockchain;Bitcoin;Genesis Block;Rehash;LevelDB;SHA-256;IBM Bluemix;IoT;Bitfinex;BitTorrent;Ethereium","Online banking;Public key;Software;Peer-to-peer computing;Computer crime;Standards","cryptography;electronic money;Internet of Things","Blockchain;cyber security;digital currency exchange security;encrypted ledger;Bitcoin transactions;distributed database;tamper proof data structure blocks;peer-to-peer permission-less network;Bitcoin digital currency;digital currency;Internet of Things;financial institutions;IoT","","","","","","","","","","IEEE","IEEE Conferences"
"Blockchain Based Autonomous Selection of Electric Vehicle Charging Station","M. Pustišek; A. Kos; U. Sedlar","NA; NA; NA","2016 International Conference on Identification, Information and Knowledge in the Internet of Things (IIKI)","","2016","","","217","222","","","","10.1109/IIKI.2016.60","","https://ieeexplore.ieee.org/stamp/stamp.jsp?arnumber=8281203","blockchain;smart contract;electric vehicle;charging station;autonomous negotiation;UML","Contracts;Electric vehicle charging;Peer-to-peer computing;Bitcoin;Protocols;Automobiles","battery storage plants;electric vehicles;Unified Modeling Language","electric vehicle charging station;electrical energy;smart node development;blockchain prototype implementation;blockchain based smart contracts;charging stations;car battery status;machine-to-machine transactions;autonomous blockchain;blockchain based autonomous selection","","","","","","","","","","IEEE","IEEE Conferences"
"On the Understanding of Gamification in Blockchain Systems","R. M. Parizi; A. Dehghantanha","NA; NA","2018 6th International Conference on Future Internet of Things and Cloud Workshops (FiCloudW)","","2018","","","214","219","","","","10.1109/W-FiCloud.2018.00041","","https://ieeexplore.ieee.org/stamp/stamp.jsp?arnumber=8488201","Decentralized software development, Blockchain, Smart contracts, Decentralized applications, Gamification, Peer-to-peer networks","Software;Software engineering;Games;Task analysis;Industries","","","","","","","","","","","","IEEE","IEEE Conferences"
"Cloud/Fog Computing Resource Management and Pricing for Blockchain Networks","Z. Xiong; S. Feng; W. Wang; D. Niyato; P. Wang; Z. Han","School of Computer Science and Engineering, Nanyang Technological University, Singapore.; School of Computer Science and Engineering, Nanyang Technological University, Singapore.; School of Computer Science and Engineering, Nanyang Technological University, Singapore.; School of Computer Science and Engineering, Nanyang Technological University, Singapore.; Department of Electrical Engineering and Computer Science, York University, Canada.; University of Houston, Houston, USA, and also with the Department of Computer Science and Engineering, Kyung Hee University, Seoul, South Korea.","IEEE Internet of Things Journal","","2018","PP","99","1","1","","","","10.1109/JIOT.2018.2871706","","https://ieeexplore.ieee.org/stamp/stamp.jsp?arnumber=8470083","Computation offloading;blockchain;proof-of-work;pricing;game theory;variational inequalities.","Pricing;Protocols;Games;Cloud computing;Resource management;Cryptography","","","","","","","","","","","","IEEE","IEEE Early Access Articles"
"Transaction Immutability and Reputation Traceability: Blockchain as a Platform for Access Controlled IoT and Human Interactivity","D. W. Kravitz","NA","2017 15th Annual Conference on Privacy, Security and Trust (PST)","","2017","","","3","309","","","","10.1109/PST.2017.00012","","https://ieeexplore.ieee.org/stamp/stamp.jsp?arnumber=8476873","IoT;blockchain;reputation;identity management;access control;audit;data integrity;entity authentication;identity fraud;impersonation attack;key agreement;digital signature;smart city","Cryptography;Protocols;Authorization;Image edge detection;Smart cities","authorisation;cryptographic protocols;fraud;Internet of Things;smart cities;telecommunication security","human interaction;cryptographic protocol suites;transaction immutability;reputation traceability;access-controlled IoT;identity fraud;massive-scale database breaches;business transactions;embedded cryptographic keys;communication lines;safety applications;blockchain-enabled anomaly detection;inviter-invitee protocol;smart city","","","","","","","","","","IEEE","IEEE Conferences"
"An IoT electric business model based on the protocol of bitcoin","Y. Zhang; J. Wen","Tsinghua University, Beijing, China; Tsinghua University, Beijing, China","2015 18th International Conference on Intelligence in Next Generation Networks","","2015","","","184","191","","","","10.1109/ICIN.2015.7073830","","https://ieeexplore.ieee.org/stamp/stamp.jsp?arnumber=7073830","E-business model;Internet of things;bitcoin","Data models;Cryptography;Proposals;Internet;Protocols;Companies","contracts;electronic commerce;electronic money;Internet;Internet of Things;peer-to-peer computing","IoT electric business model;bitcoin protocol;e-business activities;Internet of things;Internet;smart property;paid data;P2P trade;Blockchain;smart contract","","","","","","","","","","IEEE","IEEE Conferences"
"Blockchain with Accountable CP-ABE: How to Effectively Protect the Electronic Documents","C. Yuan; M. Xu; X. Si; B. Li","NA; NA; NA; NA","2017 IEEE 23rd International Conference on Parallel and Distributed Systems (ICPADS)","","2017","","","800","803","","","","10.1109/ICPADS.2017.00111","","https://ieeexplore.ieee.org/stamp/stamp.jsp?arnumber=8368440","Blockchain;CP-ABE;Accountability;Electronic Documents;Traceability","Public key;Industries;Internet of Things;Writing","data protection;document handling;public key cryptography","accountable CP-ABE;exposed decryption key;key abuser;cryptocurrency;Bitcoin technologies;data management;data protection;attribute-base encryption;public key primitive;electronic document protection;blockchain;privacy protection;KP-ABE;Key-policy ABE;Ciphertext-policy ABE;CP;KP","","","","","","","","","","IEEE","IEEE Conferences"
"An overview of blockchain technologies: Principles, opportunities and challenges","G. B. Mermer; E. Zeydan; S. S. Arslan","ING Bank, İstanbul, Türkiye; Türk Telekom Labs, İstanbul, Türkiye; MEF Üniversitesi, İstanbul, Türkiye","2018 26th Signal Processing and Communications Applications Conference (SIU)","","2018","","","1","4","","","","10.1109/SIU.2018.8404513","","https://ieeexplore.ieee.org/stamp/stamp.jsp?arnumber=8404513","Blockchain;cryptogtaphy;consensus","Dogs;Bitcoin;Blogs;Internet of Things","data integrity;Internet;security of data","blockchain technologies;trusted third party entities;in-built authenticity;user transparency;data integrity","","","","","","","","","","IEEE","IEEE Conferences"
"Blockchain-based trusted authentication in cloud radio over fiber network for 5G","H. Yang; H. Zheng; J. Zhang; Y. Wu; Y. Lee; Y. Ji","State Key Laboratory of Information Photonics and Optical Communications, Beijing University of Posts and Telecommunications, China; State Key Laboratory of Information Photonics and Optical Communications, Beijing University of Posts and Telecommunications, China; State Key Laboratory of Information Photonics and Optical Communications, Beijing University of Posts and Telecommunications, China; Huawei Technologies Co., LTD.; Huawei Technologies Co., LTD.; State Key Laboratory of Information Photonics and Optical Communications, Beijing University of Posts and Telecommunications, China","2017 16th International Conference on Optical Communications and Networks (ICOCN)","","2017","","","1","3","","","","10.1109/ICOCN.2017.8121598","","https://ieeexplore.ieee.org/stamp/stamp.jsp?arnumber=8121598","Blockchain;RoF;5G;SDN;optical network","5G mobile communication;Cloud computing;Authentication;Optical fiber networks;Conferences;Radio access networks","5G mobile communication;authorisation;cloud computing;Internet of Things;mobile computing;radio access networks;radio-over-fibre;telecommunication security","mobile core network;authentication architecture;anonymous access scheme;fiber network;trusted authentication;cloud radio access network;centralized access authentication;C-RAN;C","","","","","","","","","","IEEE","IEEE Conferences"
"Blockchain-Based Dynamic Key Management for Heterogeneous Intelligent Transportation Systems","A. Lei; H. Cruickshank; Y. Cao; P. Asuquo; C. P. A. Ogah; Z. Sun","Institute of Communication Systems, University of Surrey, Guildford, U.K.; Institute of Communication Systems, University of Surrey, Guildford, U.K.; Department of Computer and Information Sciences, Northumbria University, Newcastle-upon-Tyne, U.K.; Institute of Communication Systems, University of Surrey, Guildford, U.K.; Institute of Communication Systems, University of Surrey, Guildford, U.K.; Institute of Communication Systems, University of Surrey, Guildford, U.K.","IEEE Internet of Things Journal","","2017","4","6","1832","1843","","","","10.1109/JIOT.2017.2740569","","https://ieeexplore.ieee.org/stamp/stamp.jsp?arnumber=8010820","Blockchain;dynamic key management;handover;Intelligent Transportation System (ITS);vehicular communication systems (VCSs)","Vehicle dynamics;Internet of Things;Heterogeneous networks;Intelligent vehicles;Cryptography;Privacy;Handover;Vehicular ad hoc networks","intelligent transportation systems;road safety;road traffic;security of data","heterogeneous intelligent transportation systems;dynamic key management;vehicles handover;dynamic transaction collection period;heterogeneous VCS domains;distributed key management;decentralized blockchain structure;novel network topology;vehicle departure information;heterogeneous network;secure key management;network security;key management schemes;secured group broadcast;vehicular communication systems;traffic efficiency;road safety;transportation infrastructures;Intelligent Transportation System","","","","","","","","","","IEEE","IEEE Journals & Magazines"
"Blockchain for Secure and Efficient Data Sharing in Vehicular Edge Computing and Networks","J. Kang; R. Yu; X. Huang; M. Wu; S. Maharjan; S. Xie; Y. Zhang","School of Automation, Guangdong University of Technology, China.; School of Automation, Guangdong University of Technology, China.; School of Automation, Guangdong University of Technology, China.; School of Automation, Guangdong University of Technology, China.; Simula Metropolitan Center for Digital Engineering, and University of Oslo, Norway.; School of Automation, Guangdong University of Technology, China.; Department of Informatics, University of Oslo, Norway.","IEEE Internet of Things Journal","","2018","PP","99","1","1","","","","10.1109/JIOT.2018.2875542","","https://ieeexplore.ieee.org/stamp/stamp.jsp?arnumber=8489897","Vehicular edge computing;blockchain;smart contracts;security and privacy;reputation management.","Memory;Contracts;Edge computing;Metadata;Peer-to-peer computing","","","","","","","","","","","","IEEE","IEEE Early Access Articles"
"DNSLedger: Decentralized and distributed name resolution for ubiquitous IoT","X. Duan; Z. Yan; G. Geng; B. Yan","Computer Network Information Center, Chinese Academy of Science, Beijing 100190, China; China Internet Network Information Center, Beijing 100190, China; China Internet Network Information Center, Beijing 100190, China; Computer Network Information Center, Chinese Academy of Science, Beijing 100190, China","2018 IEEE International Conference on Consumer Electronics (ICCE)","","2018","","","1","3","","","","10.1109/ICCE.2018.8326118","","https://ieeexplore.ieee.org/stamp/stamp.jsp?arnumber=8326118","IOT;OID;DNSLedger;DNS","Conferences;Consumer electronics","Internet;Internet of Things","DNSLedger;distributed Name resolution;ubiquitous IoT;domain name management model;Domain Name System","","","","","","","","","","IEEE","IEEE Conferences"
"Volunteer service time record system based on blockchain technology","N. Zhou; M. Wu; J. Zhou","Hubei Key Laboratory of Broadband Wireless Communication and Sensor Network, School of Information Engineering, Wuhan University of Technology, Wu Han 430070, China; Hubei Key Laboratory of Broadband Wireless Communication and Sensor Network, School of Information Engineering, Wuhan University of Technology, Wu Han 430070, China; Hubei Key Laboratory of Broadband Wireless Communication and Sensor Network, School of Information Engineering, Wuhan University of Technology, Wu Han 430070, China","2017 IEEE 2nd Advanced Information Technology, Electronic and Automation Control Conference (IAEAC)","","2017","","","610","613","","","","10.1109/IAEAC.2017.8054088","","https://ieeexplore.ieee.org/stamp/stamp.jsp?arnumber=8054088","blockchain;volunteer service;data security;data store;traceability system","Public key;Contracts;Encryption;Government;Bitcoin;Internet of Things","public administration;security of data;time management","blockchain technology;volunteer service time record system;volunteer service time management;data security;traceability system;China;time recognition;public information","","","","","","","","","","IEEE","IEEE Conferences"
"A blockchain based peer-to-peer framework for exchanging leftover foreign currency","R. Bhattacharya; M. White; N. Beloff","Department of Engineering and Informatics, University of Sussex, Brighton, United Kingdom; Department of Engineering and Informatics, University of Sussex, Brighton, United Kingdom; Department of Engineering and Informatics, University of Sussex, Brighton, United Kingdom","2017 Computing Conference","","2017","","","1431","1435","","","","10.1109/SAI.2017.8252284","","https://ieeexplore.ieee.org/stamp/stamp.jsp?arnumber=8252284","Blockchain;Currency Exchange;Internet of Things;Smart Kiosk","Exchange rates;Peer-to-peer computing;Mobile communication;Bitcoin;Informatics","electronic money;financial data processing;Internet;mobile computing;peer-to-peer computing","travel currency card;blockchain;peer-to-peer currency exchange technique;international trip;mobile Web application;smart kiosk based systems;leftover foreign currency exchange","","","","","","","","","","IEEE","IEEE Conferences"
"Blockchain Platforms Overview for Industrial IoT Purposes","N. Teslya; I. Ryabchikov","SPIIRAS, St.Petersburg, Russia; SPIIRAS, St.Petersburg, Russia","2018 22nd Conference of Open Innovations Association (FRUCT)","","2018","","","250","256","","","","10.23919/FRUCT.2018.8468276","","https://ieeexplore.ieee.org/stamp/stamp.jsp?arnumber=8468276","","Contracts;Fault tolerance;Fault tolerant systems;Aerospace electronics;Hardware;Industries","contracts;cryptography;fault tolerance;Internet of Things","consensus mechanisms;private blockchains;IIoT platform development;industrial IIoT platform;Industrial IoT purposes;smart space;token exchange;fault tolerance consensus mechanism;blockchain platforms;blockchain platform implementations;contract distribution","","","","","","","","","","IEEE","IEEE Conferences"
"Evidence and Trust: IoT Collaborative Security Mechanism","B. Wen; Z. Luo; Y. Wen","Hainan Normal University, School of Information Science and Technology, Haikou, China; Hainan Normal University, School of Information Science and Technology, Haikou, China; Huazhong University of Science and Technology, School of Computer Science and Technology, Wuhan, China","2018 Eighth International Conference on Information Science and Technology (ICIST)","","2018","","","98","9","","","","10.1109/ICIST.2018.8426148","","https://ieeexplore.ieee.org/stamp/stamp.jsp?arnumber=8426148","Internet of Things;evidence;blockchain services;collaborative security","Cryptography;Collaboration;Internet;Contracts;Distributed databases","data structures;digital forensics;Internet of Things;security of data;trusted computing","IoT collaborative security mechanism;authenticity;legitimacy;forensics;tamper-proof;unforgeable decentralized shared ledger;blockchain services;data blocks;data structures;data stability;data evidence","","","","","","","","","","IEEE","IEEE Conferences"
"ControlChain: Blockchain as a Central Enabler for Access Control Authorizations in the IoT","O. J. A. Pinno; A. R. A. Gregio; L. C. E. De Bona","NA; NA; NA","GLOBECOM 2017 - 2017 IEEE Global Communications Conference","","2017","","","1","6","","","","10.1109/GLOCOM.2017.8254521","","https://ieeexplore.ieee.org/stamp/stamp.jsp?arnumber=8254521","","Authorization;Computer architecture;Registers;Proposals;Process control;Contracts","authorisation;computer network security;data privacy;Internet of Things","communication capabilities;blockchain;IoT access authorizations;IoT tendency requirements;access control models;access control authorization;transport systems","","","","","","","","","","IEEE","IEEE Conferences"
"Game theoretic study on blockchain based secure edge networks","D. Xu; L. Xiao; L. Sun; M. Lei","Dept. of Communication Engineering, Xiamen University, China; Dept. of Communication Engineering, Xiamen University, China; Beijing Key Laboratory of IOT Information Security Technology, Institute of Information Engineering, CAS, China; Information Security Center, Beijing University of Posts and Telecommunications, China","2017 IEEE/CIC International Conference on Communications in China (ICCC)","","2017","","","1","5","","","","10.1109/ICCChina.2017.8330529","","https://ieeexplore.ieee.org/stamp/stamp.jsp?arnumber=8330529","Blockchain;edge network;game theory;network security","Servers;Security;Games;Mobile handsets;Performance evaluation;Cloud computing","data privacy;game theory","game theoretic study;network security;punishment scheme;attack motivation;edge server;mobile device;edge network;blockchain security game;illegal security gains;data privacy;blockchain-based secure edge networks;Nash equilibria;NE","","","","","","","","","","IEEE","IEEE Conferences"
"CredenceLedger: A Permissioned Blockchain for Verifiable Academic Credentials","R. Arenas; P. Fernandez","Ateneo de Manila University, Department of Information Systems and Computer Science, Manila, Philippines; Ateneo de Manila University, Department of Information Systems and Computer Science, Manila, Philippines","2018 IEEE International Conference on Engineering, Technology and Innovation (ICE/ITMC)","","2018","","","1","6","","","","10.1109/ICE.2018.8436324","","https://ieeexplore.ieee.org/stamp/stamp.jsp?arnumber=8436324","Blockchain;Cryptocurrency;Decentralized Verification;Stream;Mining","Bitcoin;Peer-to-peer computing;Education","cryptography;data privacy;electronic commerce;health care;Internet;Internet of Things","governance;key attributes;security;permissioned Blockchain;specific educational use case;decentralized verification;Blockchain-based solution;CredenceLedger;digital academic credentials;Blockchain ledger;education stakeholders;verifiable academic credentials;powers cryptocurrencies;governments;research communities;industry stakeholders;compact data proofs","","","","","","","","","","IEEE","IEEE Conferences"
"Distributed access control on IoT ledger-based architecture","R. C. Lunardi; R. A. Michelin; C. V. Neu; A. F. Zorzo","PUCRS - Brazil; PUCRS - Brazil; PUCRS - Brazil; PUCRS - Brazil","NOMS 2018 - 2018 IEEE/IFIP Network Operations and Management Symposium","","2018","","","1","7","","","","10.1109/NOMS.2018.8406154","","https://ieeexplore.ieee.org/stamp/stamp.jsp?arnumber=8406154","","Logic gates;Hardware;Access control;Computer architecture;Performance evaluation","authorisation;data privacy;Internet of Things;microcomputers;performance evaluation","Internet of Things devices;Arduino;Raspberry Pi;Orange Pi boards;information propagation;private IoT network scenario;IoT devices;devices hardware limitations;devices performance;IoT networks;IoT ledger-based architecture;distributed access control","","","","","","","","","","IEEE","IEEE Conferences"
"Fully Automated Multi-Resolution Channels and Multithreaded Spectrum Allocation Protocol for IoT Based Sensor Nets","T. Hassan; S. Aslam; J. W. Jang","Department of Electrical Engineering, Bahria University, Islamabad, Pakistan; Department of Electrical Engineering, Bahria University, Islamabad, Pakistan; Department of Electronic Engineering, Sogang University, Seoul, South Korea","IEEE Access","","2018","6","","22545","22556","","","","10.1109/ACCESS.2018.2829078","","https://ieeexplore.ieee.org/stamp/stamp.jsp?arnumber=8345661","Internet-of-Things (IoTs);wireless sensor networks (WSN);support vector machines (SVM);spectrum allocation","Protocols;Feature extraction;Data communication;Resource management;Throughput;Wireless sensor networks;Channel allocation","channel allocation;Internet of Things;learning (artificial intelligence);multilayer perceptrons;pattern classification;probability;protocols;radial basis function networks;radio networks;support vector machines;telecommunication computing;wireless channels","IoT based sensor nets;multilayer perceptron-based nonlinear support vector machines classification model;multistage Gaussian radial basis function;channel utilization;network topology;maximum data transfer;neighboring channel;network metrics;multiuser data;fully automated self-learning;maximum data transmission;adaptive protocol;multichannel sensor networks;channel allocation;high data rate real-time applications;multithreaded spectrum allocation protocol;fully automated multiresolution channels","","","","","","","","","","IEEE","IEEE Journals & Magazines"
"Towards Realistic Energy Profiling of Blockchains for Securing Internet of Things","S. Sankaran; S. Sanju; K. Achuthan","NA; NA; NA","2018 IEEE 38th International Conference on Distributed Computing Systems (ICDCS)","","2018","","","1454","1459","","","","10.1109/ICDCS.2018.00148","","https://ieeexplore.ieee.org/stamp/stamp.jsp?arnumber=8416411","Blockchains;Internet of Things;Energy Profiling","Servers;Throughput;Performance evaluation;Power demand;Benchmark testing;Power measurement","energy conservation;energy consumption;Internet of Things;protocols;transaction processing","blockchain;IoTs;remote monitoring;energy consumption;workloads;secure protocols;energy profiling;transaction verification;energy-performance;smart contracts;Ethereum","","","","","","","","","","IEEE","IEEE Conferences"
"An Overview of Smart Contract and Use Cases in Blockchain Technology","B. K. Mohanta; S. S. Panda; D. Jena","IIIT, Bhubaneswar, Odisha, 751003, India; IIIT, Bhubaneswar, Odisha, 751003, India; IIIT, Bhubaneswar, Odisha, 751003, India","2018 9th International Conference on Computing, Communication and Networking Technologies (ICCCNT)","","2018","","","1","4","","","","10.1109/ICCCNT.2018.8494045","","https://ieeexplore.ieee.org/stamp/stamp.jsp?arnumber=8494045","Smart Contract;Blockchain;Event Driven;Distributed","Contracts;Bitcoin;Supply chains;Internet of Things","","","","","","","","","","","","IEEE","IEEE Conferences"
