"TM-Coin: Trustworthy management of TCB measurements in IoT","J. Park; Kwangjo Kim","Institute of ETRI, South Korea; Graduate School of Information Security, School of Computing, KAIST, South Korea","2017 IEEE International Conference on Pervasive Computing and Communications Workshops (PerCom Workshops)","","2017","","","654","659","","","","10.1109/PERCOMW.2017.7917640","","https://ieeexplore.ieee.org/stamp/stamp.jsp?arnumber=7917640","IoT;measurement management;remote attestation;blockchain;ARM TrustZone","Public key;Protocols;Current measurement;Performance evaluation;Hardware;Conferences","database management systems;Internet of Things;trusted computing","trusted computing base;TCB measurement trustworthy management;remote attestation redundant execution;TCB measurement-coin;TM-Coin;ARM TrustZone;TM-Coin transactions;IoT devices;decentralized database;sensed data remote attestation","","","","","","","","","","IEEE","IEEE Conferences"
"Securing Smart Cities Using Blockchain Technology","K. Biswas; V. Muthukkumarasamy","NA; NA","2016 IEEE 18th International Conference on High Performance Computing and Communications; IEEE 14th International Conference on Smart City; IEEE 2nd International Conference on Data Science and Systems (HPCC/SmartCity/DSS)","","2016","","","1392","1393","","","","10.1109/HPCC-SmartCity-DSS.2016.0198","","https://ieeexplore.ieee.org/stamp/stamp.jsp?arnumber=7828539","Smart city;Smart device;Blockchain;Security","","data privacy;smart cities","smart city;information technology;physical infrastructures;social infrastructures;business infrastructures;resources utilization;information security;privacy;security framework;blockchain technology;smart devices;secure communication","","","","","","","","","","IEEE","IEEE Conferences"
"Performance Analysis and Application of Mobile Blockchain","K. Suankaewmanee; D. T. Hoang; D. Niyato; S. Sawadsitang; P. Wang; Z. Han","School of Computer Science and Engineering, Nanyang Technological University, Singapore; School of Computer Science and Engineering, Nanyang Technological University, Singapore; School of Computer Science and Engineering, Nanyang Technological University, Singapore; School of Computer Science and Engineering, Nanyang Technological University, Singapore; School of Computer Science and Engineering, Nanyang Technological University, Singapore; Department of Electrical and Computer Engineering, University of Houston, USA","2018 International Conference on Computing, Networking and Communications (ICNC)","","2018","","","642","646","","","","10.1109/ICCNC.2018.8390265","","https://ieeexplore.ieee.org/stamp/stamp.jsp?arnumber=8390265","Blockchain;mobile commerce;Android application;mobile security","Peer-to-peer computing;Mobile nodes;Servers;Public key","cloud computing;data mining;electronic commerce;Internet;mobile computing;security of data","performance analysis;mobile blockchain;mobile security;mobile commerce;data security problems;effective security solution;cloud computing;Internet-of-Things;m-commerce application;blockchain technology;MobiChain application;mobile devices;efficient security solution;future m-commerce","","","","","","","","","","IEEE","IEEE Conferences"
"Blockchain-Based Security Layer for Identification and Isolation of Malicious Things in IoT: A Conceptual Design","M. Banerjee; J. Lee; Q. Chen; K. R. Choo","NA; NA; NA; NA","2018 27th International Conference on Computer Communication and Networks (ICCCN)","","2018","","","1","6","","","","10.1109/ICCCN.2018.8487447","","https://ieeexplore.ieee.org/stamp/stamp.jsp?arnumber=8487447","","Contracts;Authorization;Authentication;Hardware;Measurement","","","","","","","","","","","","IEEE","IEEE Conferences"
"A Blockchain-Based Authentication and Security Mechanism for IoT","D. Li; W. Peng; W. Deng; F. Gai","NA; NA; NA; NA","2018 27th International Conference on Computer Communication and Networks (ICCCN)","","2018","","","1","6","","","","10.1109/ICCCN.2018.8487449","","https://ieeexplore.ieee.org/stamp/stamp.jsp?arnumber=8487449","","Authentication;Peer-to-peer computing;Public key;Microprogramming;Contracts","","","","","","","","","","","","IEEE","IEEE Conferences"
"SMEAD: A secured mobile enabled assisting device for diabetics monitoring","M. Saravanan; R. Shubha; A. M. Marks; V. Iyer","Ericsson Research India, Chennai, India; VIT University, India; VIT University, India; SRM University, Chennai, India","2017 IEEE International Conference on Advanced Networks and Telecommunications Systems (ANTS)","","2017","","","1","6","","","","10.1109/ANTS.2017.8384099","","https://ieeexplore.ieee.org/stamp/stamp.jsp?arnumber=8384099","Diabetics Monitoring;MEDIBOX;Blockchain;IOT;Mobile Phone","Monitoring;Biomedical monitoring;Diabetes;Medical diagnostic imaging;Security;Temperature sensors","artificial intelligence;cloud computing;cryptography;data privacy;diseases;health care;Internet of Things;medical information systems;mobile computing;patient monitoring;social networking (online)","diagnostic tools;augmented intelligence;sensor devices;gateway;evidence-based medicine system;SMEAD;end-to-end secured system;diabetic patients;medication;insulin dosage;cryptographic security;formalized data access;secured mobile enabled assisting device;wearable health devices;mobile apps;cloud-based platforms;Internet of Things;MEDIBOX;blockchain-based disruptive technology;smart contracts;social networks;diabetics monitoring;patient assisting devices;privacy","","","","","","","","","","IEEE","IEEE Conferences"
"Blockchains everywhere - a use-case of blockchains in the pharma supply-chain","T. Bocek; B. B. Rodrigues; T. Strasser; B. Stiller","Communication Systems Group (CSG), Department of Informatics (IfI), University of Z&#x00FC;rich (UZH), Switzerland; Communication Systems Group (CSG), Department of Informatics (IfI), University of Z&#x00FC;rich (UZH), Switzerland; Communication Systems Group (CSG), Department of Informatics (IfI), University of Z&#x00FC;rich (UZH), Switzerland; Communication Systems Group (CSG), Department of Informatics (IfI), University of Z&#x00FC;rich (UZH), Switzerland","2017 IFIP/IEEE Symposium on Integrated Network and Service Management (IM)","","2017","","","772","777","","","","10.23919/INM.2017.7987376","","https://ieeexplore.ieee.org/stamp/stamp.jsp?arnumber=7987376","","Contracts;Temperature sensors;Bitcoin;Pharmaceuticals;Supply chains;Temperature distribution;Diamond","contracts;cost reduction;Internet of Things;pharmaceutical industry;production engineering computing;quality control;sensors;supply chains","blockchain use-case;Gartner Hype Cycle 2016;technology portfolio;modum.io;IoT sensor devices;Internet of Things;blockchain technology;data immutability;temperature record public accessibility;operational cost reduction;pharmaceutical supply-chain;medical industry;environmental control process;quality control;regulatory compliance;medical product transportation;temperature monitoring;GDP regulations;smart contract;product attributes","","","","","","","","","","IEEE","IEEE Conferences"
"Using Blockchain Technology to Ensure Trustful Information Flow Monitoring in CPS","S. Gries; O. Meyer; F. Wessling; M. Hesenius; V. Gruhn","NA; NA; NA; NA; NA","2018 IEEE International Conference on Software Architecture Companion (ICSA-C)","","2018","","","35","38","","","","10.1109/ICSA-C.2018.00014","","https://ieeexplore.ieee.org/stamp/stamp.jsp?arnumber=8432169","information flow monitor;blockchain;trust;semantic dependencies;cps;cyber-physical systems;iot;internet of things","Monitoring;Task analysis;Protocols;Cyber-physical systems;Runtime;History","financial data processing;trusted computing","blockchain technology;trustful information flow monitoring;CPS;semantic dependencies;monitoring tools;dependency information;information exchange;decentralized storage mechanisms;cyber-physical systems","","","","","","","","","","IEEE","IEEE Conferences"
"An architecture pattern for trusted orchestration in IoT edge clouds","C. Pahl; N. E. Ioini; S. Helmer; B. Lee","Faculty of Computer Science, Free University of Bozen-Bolzano, 39100 Bolzano, Italy; Faculty of Computer Science, Free University of Bozen-Bolzano, 39100 Bolzano, Italy; Faculty of Computer Science, Free University of Bozen-Bolzano, 39100 Bolzano, Italy; Software Research Institue, Athlone Institute of Technology, Athlone, Ireland","2018 Third International Conference on Fog and Mobile Edge Computing (FMEC)","","2018","","","63","70","","","","10.1109/FMEC.2018.8364046","","https://ieeexplore.ieee.org/stamp/stamp.jsp?arnumber=8364046","Architecture Pattern;Blockchain;IoT;Edge Cloud;Fog Computing;Orchestration;Trust","Computer architecture;Sensors;Contracts;Containers;Cloud computing","cloud computing;Internet of Things;software architecture;trusted computing","centralised clouds;cloud services;dynamic settings;organisational boundaries;trust concerns;orchestration activities;architecture pattern;trusted orchestration;IoT edge clouds;edge architectures;orchestration techniques","","","","","","","","","","IEEE","IEEE Conferences"
"Blockchain-based Decentralized Trust Management in Vehicular Networks","Z. Yang; K. Yang; L. Lei; K. Zheng; V. C. M. Leung","Intelligent Computing and Communication (IC) Lab, Key Laboratory of Universal Wireless Communications, Ministry of Education, Beijing University of Posts and Telecommunications (BUPT), Beijing, 100876, China.; Department of Computer Science, University of Memphis, Memphis, TN 38152, USA.; School of Science and Engineering, James Cook University, Cairns, QLD, 4878, Australia.; Intelligent Computing and Communication (IC) Lab, Key Laboratory of Universal Wireless Communications, Ministry of Education, Beijing University of Posts and Telecommunications (BUPT), Beijing, 100876, China.; Department of Electrical and Computer Engineering, The University of British Columbia, Vancouver, BC V6T 1Z4, Canada.","IEEE Internet of Things Journal","","2018","PP","99","1","1","","","","10.1109/JIOT.2018.2836144","","https://ieeexplore.ieee.org/stamp/stamp.jsp?arnumber=8358773","Blockchain;trust management;vehicular networks;data credibility.","Servers;Receivers;Reliability;Task analysis;Safety","","","","","","","","","","","","IEEE","IEEE Early Access Articles"
"A Secure Charging Scheme for Electric Vehicles with Smart Communities in Energy Blockchain","Z. Su; Y. Wang; Q. Xu; M. Fei; Y. Tian; N. Zhang","School of Mechatronic Engineering and Automation, Shanghai University, Shanghai, China.; School of Mechatronic Engineering and Automation, Shanghai University, Shanghai, China.; School of Mechatronic Engineering and Automation, Shanghai University, Shanghai, China.; School of Mechatronic Engineering and Automation, Shanghai University, Shanghai, China.; School of Electrical Engineering and Computer Science, Queensland University of Technology, Australia.; Department of Computing Science, Texas A&M University at Corpus Christi, TX, USA.","IEEE Internet of Things Journal","","2018","PP","99","1","1","","","","10.1109/JIOT.2018.2869297","","https://ieeexplore.ieee.org/stamp/stamp.jsp?arnumber=8457186","Energy blockchain;Smart community (SC);Electric vehicles (EVs);Contract theory.","Contracts;Electric vehicle charging;Microgrids;Privacy","","","","","","","","","","","","IEEE","IEEE Early Access Articles"
"An Overview of Blockchain Technology: Architecture, Consensus, and Future Trends","Z. Zheng; S. Xie; H. Dai; X. Chen; H. Wang","NA; NA; NA; NA; NA","2017 IEEE International Congress on Big Data (BigData Congress)","","2017","","","557","564","","","","10.1109/BigDataCongress.2017.85","","https://ieeexplore.ieee.org/stamp/stamp.jsp?arnumber=8029379","Blockchain;decentralization;consensus;scalability","Bitcoin;Peer-to-peer computing;Organizations;Contracts","cryptography;electronic money","blockchain technology;Bitcoin;immutable ledger;blockchain-based applications;consensus algorithms","","","","","","","","","","IEEE","IEEE Conferences"
"Spatial Blockchain-based Secure Mass Screening Framework for Children with Dyslexia","M. A. Rahman; M. S. Hossain; E. Hassanain; M. Rashid; S. Barnes","Department of Forensic Computing and Cyber Security, Faculty Computing and Cyber Sciences, University of Prince Mugrin, Madinah, KSA.; Department of Software Engineering, College of Computer and Information Sciences, King Saud University, Riyadh 11543, Saudi Arabia.; Department of Forensic Computing and Cyber Security, Faculty Computing and Cyber Sciences, University of Prince Mugrin, Madinah, KSA.; Consumer and Organizational Digital Analytics (CODA) Research Centre, King’s Business School, King’s College London, UK.; Consumer and Organizational Digital Analytics (CODA) Research Centre, King’s Business School, King’s College London, UK.","IEEE Access","","2018","PP","99","1","1","","","","10.1109/ACCESS.2018.2875242","","https://ieeexplore.ieee.org/stamp/stamp.jsp?arnumber=8488459","blockchain;dyslexia;auto-grading;mass screening;mobile multimedia health","Big Data;Writing;Stakeholders;Testing;Multimedia systems","","","","","","","","","","","","IEEE","IEEE Early Access Articles"
"Efficient and Privacy-preserving Carpooling using Blockchain-assisted Vehicular Fog Computing","M. Li; L. Zhu; X. Lin","School of Computer Science and Technology at Beijing Institute of Technology.; School of Computer Science and Technology at Beijing Institute of Technology.; Department of Physics and Computer Science at Wilfrid Laurier University.","IEEE Internet of Things Journal","","2018","PP","99","1","1","","","","10.1109/JIOT.2018.2868076","","https://ieeexplore.ieee.org/stamp/stamp.jsp?arnumber=8452961","Carpooling;Fog Computing;Blockchain;User Matching;Security and Privacy.","Vehicles;Servers;Cloud computing;Cryptography;Edge computing;Privacy","","","","","","","","","","","","IEEE","IEEE Early Access Articles"
"Law as a service (LaaS): Enabling legal protection over a blockchain network","M. U. Wasim; A. A. Z. A. Ibrahim; P. Bouvry; T. Limba","Computer Science &amp; Communications Research Unit, University of Luxembourg, Luxembourg; Computer Science &amp; Communications Research Unit, University of Luxembourg, Luxembourg; Computer Science &amp; Communications Research Unit, University of Luxembourg, Luxembourg; Digital and Creative Industries LAB, Mykolas Romeris University, Lithuania","2017 14th International Conference on Smart Cities: Improving Quality of Life Using ICT & IoT (HONET-ICT)","","2017","","","110","114","","","","10.1109/HONET.2017.8102214","","https://ieeexplore.ieee.org/stamp/stamp.jsp?arnumber=8102214","blockchain;smart contract;contract law;breach of contract;court injunction;unsupervised machine learning;factor analysis;stochastic modeling;structural equation modeling","","cloud computing;contract law;contracts;data protection;parallel processing;probability;stochastic processes","smart contract;court injunction;PFM;high performance computing cluster;blockchain network;legal protection;service level agreements;law as a service;LaaS;online contracts breaches;SLA;probability based factor model;factor analysis;stochastic modeling;HPC","","","","","","","","","","IEEE","IEEE Conferences"
"A Blockchain Based Privacy-Preserving Incentive Mechanism in Crowdsensing Applications","J. Wang; M. Li; Y. He; H. Li; K. Xiao; C. Wang","Department of Computer Science, North China University of Technology, Beijing, China; Department of Computer Science, North China University of Technology, Beijing, China; Department of Computer Science, North China University of Technology, Beijing, China; Beijing Key Laboratory IOT Information Security Technology, Chinese Academy of Sciences, Beijing, China; Department of Computer Science, North China University of Technology, Beijing, China; Department of Computer Science, North China University of Technology, Beijing, China","IEEE Access","","2018","6","","17545","17556","","","","10.1109/ACCESS.2018.2805837","","https://ieeexplore.ieee.org/stamp/stamp.jsp?arnumber=8306424","Blockchain;crowdsensing;incentive mechanism;node cooperation;privacy-preserving;signcryption","Sensors;Servers;Task analysis;Data privacy;Privacy","cryptography;data protection;mobile computing;sensor fusion;smart phones","cryptocurrency;transaction blocks;incentive mechanisms;blockchain based privacy-preserving incentive mechanism;k-anonymity privacy protection;sensing data assessment criteria;secure incentive way;crowdsensing applications;privacy-preserving blockchain incentive mechanism;large-scale sensing data;pervasive smartphone users","","","","","","","","","","IEEE","IEEE Journals & Magazines"
"Analysing the transformational Effect of Emerging Technologies on Smart Cities: Blockchain and IoT","","","2018 3rd International Conference on Smart and Sustainable Technologies (SpliTech)","","2018","","","1","10","","","","","","https://ieeexplore.ieee.org/stamp/stamp.jsp?arnumber=8448357","Smart city;emerging technologies;transformation;IoT;Blockchain;socio-technical perspective","Smart cities","","","","","","","","","","","","IEEE","IEEE Conferences"
"Cloud Message Queueing and Notification: Challenges and Opportunities","C. Esposito; F. Palmieri; K. R. Choo","University of Napoli Federico II; University of Salerno; University of Texas at San Antonio","IEEE Cloud Computing","","2018","5","2","11","16","","","","10.1109/MCC.2018.022171662","","https://ieeexplore.ieee.org/stamp/stamp.jsp?arnumber=8354709","Cloud Computing;blockchain;security;privacy;queueing","Cloud computing;Privacy;Smart phones;Servers;Internet of Things","cloud computing;data integrity;data privacy;mobile computing;queueing theory","cloud service providers;mobile system manufacturing companies;mobile applications;blockchain technology;large-scale network-centric software projects;event notification facilities;back-end services;notification infrastructure;Cloud Message Queueing;Cloud Message Notification;mobile app development;data privacy;data integrity","","","","","","","","","","IEEE","IEEE Journals & Magazines"
"DistBlockNet: A Distributed Blockchains-Based Secure SDN Architecture for IoT Networks","P. K. Sharma; S. Singh; Y. Jeong; J. H. Park","NA; NA; NA; NA","IEEE Communications Magazine","","2017","55","9","78","85","","","","10.1109/MCOM.2017.1700041","","https://ieeexplore.ieee.org/stamp/stamp.jsp?arnumber=8030491","","Smart devices;Computer architecture;Scalability;Metadata;Performance evaluation;Software defined networking;Network architecture","Internet;Internet of Things;peer-to-peer computing;software defined networking","DistBlockNet;distributed blockchains;IoT networks;smart devices;Internet;distributed secure SDN architecture;blockchains technology;distributed peer-to-peer network;flow rule table;IoT forwarding devices","","","","","","","","","","IEEE","IEEE Journals & Magazines"
"Secure and Energy-Efficient Handover in Fog Networks Using Blockchain-Based DMM","V. Sharma; I. You; F. Palmieri; D. N. K. Jayakody; J. Li","NA; NA; NA; NA; NA","IEEE Communications Magazine","","2018","56","5","22","31","","","","10.1109/MCOM.2018.1700863","","https://ieeexplore.ieee.org/stamp/stamp.jsp?arnumber=8360846","","Handover;Energy efficiency;Servers;Authentication;Cloud computing;Edge computing;5G mobile communication;Energy consumption;Mobile nodes;Network architecture","5G mobile communication;Internet of Things;mobility management (mobile radio);telecommunication security","flat architectures;DMM schema;blockchain;network layout;fog networks;DMM modern fog network architectures;IoT applications;5G communications technologies;mobile nodes;frequent handovers;handover security;obvious security","","","","","","","","","","IEEE","IEEE Journals & Magazines"
"IoT based Security Model to Enhance Blockchain Technology","S. Awasthi; P. Johri; S. K. Khatri","Amity University, Noida, Uttar Pradesh, India; Galgotias University, Greater Noida, India; Amity University, Noida, Uttar Pradesh, India","2018 International Conference on Advances in Computing and Communication Engineering (ICACCE)","","2018","","","133","137","","","","10.1109/ICACCE.2018.8441720","","https://ieeexplore.ieee.org/stamp/stamp.jsp?arnumber=8441720","Blockchain;private key;Unique Id;block nodes;Validator;Bitcoin;Ethereum","Tools;Software;Testing;Organizations;Automation;Production;Pipelines","","","","","","","","","","","","IEEE","IEEE Conferences"
"BlockSee: Blockchain for IoT Video Surveillance in Smart Cities","P. Gallo; S. Pongnumkul; U. Quoc Nguyen","University of Palermo / CNIT, Italy; NECTEC, Thailand; PTIT, Vietnam","2018 IEEE International Conference on Environment and Electrical Engineering and 2018 IEEE Industrial and Commercial Power Systems Europe (EEEIC / I&CPS Europe)","","2018","","","1","6","","","","10.1109/EEEIC.2018.8493895","","https://ieeexplore.ieee.org/stamp/stamp.jsp?arnumber=8493895","","Cameras;Bitcoin;Privacy;Contracts;Video surveillance;Urban areas","","","","","","","","","","","","IEEE","IEEE Conferences"
"Cyber-Physical-Social Systems: The State of the Art and Perspectives","J. J. Zhang; F. Wang; X. Wang; G. Xiong; F. Zhu; Y. Lv; J. Hou; S. Han; Y. Yuan; Q. Lu; Y. Lee","Key Laboratory for Management and Control of Complex Systems, Institute of Automation, Chinese Academy of Sciences, Beijing, China; Key Laboratory for Management and Control of Complex Systems, Institute of Automation, Chinese Academy of Sciences, Beijing, China; Key Laboratory for Management and Control of Complex Systems, Institute of Automation, Chinese Academy of Sciences, Beijing, China; Beijing Engineering Research Center of Intelligent Systems and Technology, Institute of Automation, Chinese Academy of Sciences, Beijing, China; Key Laboratory for Management and Control of Complex Systems, Institute of Automation, Chinese Academy of Sciences, Beijing, China; Key Laboratory for Management and Control of Complex Systems, Institute of Automation, Chinese Academy of Sciences, Beijing, China; Parallel Energy Intelligence Innovation Center, Qingdao Academy of Intelligent Industries, Qingdao, China; Key Laboratory for Management and Control of Complex Systems, Institute of Automation, Chinese Academy of Sciences, Beijing, China; Key Laboratory for Management and Control of Complex Systems, Institute of Automation, Chinese Academy of Sciences, Beijing, China; School of Electrical Engineering, Wuhan University, Wuhan, China; Department of Electrical and Computer Engineering, Ritchie School of Engineering and Computer Science, University of Denver, Denver, CO, USA","IEEE Transactions on Computational Social Systems","","2018","5","3","829","840","","","","10.1109/TCSS.2018.2861224","","https://ieeexplore.ieee.org/stamp/stamp.jsp?arnumber=8464032","Artificial societies;Computational experiments;Parallel execution (ACP);blockchain;cyber-physical-social system (CPSS);Internet of Minds (IoM);parallel systems;social computing","Transportation;Automation;Social computing;Social network services;Complex systems;Big Data","cyber-physical systems;Internet of Things;social sciences computing","cyber-physical-social systems;CPSS;parallel society;artificial societies;parallel execution approach;computational experiments;ACP approach;knowledge automation;Internet of things;Internet of minds;cutting-edge applications;blockchainized IoM technology","","","","","","","","","","IEEE","IEEE Journals & Magazines"
"BIDaaS: Blockchain Based ID As a Service","J. Lee","Department of Software, Sangmyung University, Cheonan, South Korea","IEEE Access","","2018","6","","2274","2278","","","","10.1109/ACCESS.2017.2782733","","https://ieeexplore.ieee.org/stamp/stamp.jsp?arnumber=8187625","Blockchain;IDaaS;identity;authentication","Mobile communication;Authentication;Public key;Peer-to-peer computing;Companies;Bitcoin","authorisation;cloud computing;cryptography;data privacy;mobile computing","BIDaaS;functional technology;existing technologies;utilizing blockchain technology;digital identity management;authentication management infrastructure;blockchain based ID As a Service;mobile users;mobile telecommunication company","","","","","","","","","","IEEE","IEEE Journals & Magazines"
"A Survey of Blockchain: Techniques, Applications, and Challenges","W. Gao; W. G. Hatcher; W. Yu","NA; NA; NA","2018 27th International Conference on Computer Communication and Networks (ICCCN)","","2018","","","1","11","","","","10.1109/ICCCN.2018.8487348","","https://ieeexplore.ieee.org/stamp/stamp.jsp?arnumber=8487348","","Cryptography;Digital signatures;Internet of Things;Peer-to-peer computing;Big Data","","","","","","","","","","","","IEEE","IEEE Conferences"
"Revenue Growth is the Primary Benefit of the Cloud","B. Power; J. Weinman","MAXOS; XFORMA LLC.","IEEE Cloud Computing","","2018","5","4","89","94","","","","10.1109/MCC.2018.043221018","","https://ieeexplore.ieee.org/stamp/stamp.jsp?arnumber=8436080","cloud computing;saas;iaas;IoT","Cloud computing;Technological innovation;Companies;Acceleration;Tools;Economics","cloud computing;cost reduction;customer relationship management;microeconomics","big data;artificial intelligence;Internet of Things;blockchain;customer interactions;cloud computing;customer value;revenue growth;cost savings;customer relationships","","","","","","","","","","IEEE","IEEE Journals & Magazines"
