"Document Title",Authors,"Author Affiliations","Publication Title",Date Added To Xplore,"Publication_Year","Volume","Issue","Start Page","End Page","Abstract","ISSN",ISBNs,"DOI",Funding Information,PDF Link,"Author Keywords","IEEE Terms","INSPEC Controlled Terms","INSPEC Non-Controlled Terms","Mesh_Terms",Article Citation Count,Patent Citation Count,"Reference Count","Copyright Year","License","Online Date",Issue Date,"Meeting Date","Publisher",Document Identifier
"Blockchain-Based Software-Defined Industrial Internet of Things: A Dueling Deep Q-Learning Approach","C. Qiu; F. R. Yu; H. Yao; C. Jiang; F. Xu; C. Zhao","NA; NA; NA; NA; NA; NA","IEEE Internet of Things Journal","","2018","PP","99","1","1","","","","10.1109/JIOT.2018.2871394","","https://ieeexplore.ieee.org/stamp/stamp.jsp?arnumber=8469030","Industrial Internet of Things (IIoT);software-defined networking (SDN);multiple controllers;blockchain;dueling deep Q-learning.","Protocols;Internet of Things;Computational modeling;Synchronization;Computer architecture;Aerospace electronics","","","","","","","","","","","","IEEE","IEEE Early Access Articles"
"Blockchain: A game changer for securing IoT data","M. Singh; A. Singh; S. Kim","Yonsei Institute of Convergence Technology, Yonsei University, Songdo South Korea; Department of Mechanical Engineering, IIT-Roorkee, Roorkee, India; School of Integrated Technology, Yonsei University, Seoul, South Korea","2018 IEEE 4th World Forum on Internet of Things (WF-IoT)","","2018","","","51","55","","","","10.1109/WF-IoT.2018.8355182","","https://ieeexplore.ieee.org/stamp/stamp.jsp?arnumber=8355182","Internet of things;Blockchain;Security;Devices;Network","Peer-to-peer computing;Cryptography;Internet of Things;Servers;Automobiles","Internet of Things;security of data","online systems;security technologies;secure IoT systems;blockchain technology;Blockchain network;initial stage;IoT devices;cyber-attacks;IoT data","","","","","","","","","","IEEE","IEEE Conferences"
"Blockchain and the Internet of Things in the Industrial Sector","D. Miller","IBM","IT Professional","","2018","20","3","15","18","","","","10.1109/MITP.2018.032501742","","https://ieeexplore.ieee.org/stamp/stamp.jsp?arnumber=8378971","Blockchain;IoT;blockchain and industrial sector;blockchain technologies;internet of things;blockchain and IoT","Maintenance engineering;Industrial engineering;Internet of Things;Supply chains;Blockchain","Internet of Things;organisational aspects","industrial market;industrial sector;Internet of Things;IoT;business opportunities","","","","","","","","","","IEEE","IEEE Journals & Magazines"
"Can Blockchain Strengthen the Internet of Things?","N. Kshetri","University of North Carolina at Greensboro","IT Professional","","2017","19","4","68","72","","","","10.1109/MITP.2017.3051335","","https://ieeexplore.ieee.org/stamp/stamp.jsp?arnumber=8012302","blockchain;cloud computing;cybersecurity;identity and access management;Internet of Things;Mirai malware","Supply chains;Cloud computing;Computer crime;Servers;Cryptography;Internet of Things;Identity management;Malware","cloud computing;cryptography;file servers;Internet of Things;organisational aspects;production engineering computing;supply chains","Internet of Things;security strengthening;blockchain-IoT security nexus;blockchain-based solutions;IoT ecosystem;centralized cloud servers;blockchain decentralized nature;manipulation;forgery;malicious participants;blockchain-based identity;access management systems;supply chains;IoT security breach;organization initiatives;interorganizational networks","","","","","","","","","","IEEE","IEEE Journals & Magazines"
"Blockchain and Internet of Things data provider for smart applications","B. C. Florea","Department of Applied Electronics and Information Engineering, Politehnica University of Bucharest, Bucharest, Romania","2018 7th Mediterranean Conference on Embedded Computing (MECO)","","2018","","","1","4","","","","10.1109/MECO.2018.8406041","","https://ieeexplore.ieee.org/stamp/stamp.jsp?arnumber=8406041","blockchain;internet of things;decentralized;distributed;data provider;tangle","Cryptography;Peer-to-peer computing;Distributed databases;Embedded computing;Internet of Things;Computers","cryptography;data privacy;Internet of Things;peer-to-peer computing","decentralized applications;smart applications;blockchain technology;peer-to-peer network;decentralized distributed ledger;Internet of Things data provider;anonymous transaction;central authority;cryptographic proof","","","","","","","","","","IEEE","IEEE Conferences"
"Blockchain as a Service for IoT","M. Samaniego; R. Deters","NA; NA","2016 IEEE International Conference on Internet of Things (iThings) and IEEE Green Computing and Communications (GreenCom) and IEEE Cyber, Physical and Social Computing (CPSCom) and IEEE Smart Data (SmartData)","","2016","","","433","436","","","","10.1109/iThings-GreenCom-CPSCom-SmartData.2016.102","","https://ieeexplore.ieee.org/stamp/stamp.jsp?arnumber=7917130","Blockchain as a service;IoT;edge","Delays;Cloud computing;Internet of Things;Distributed databases;Computer science;Online banking;Bandwidth","cloud computing;Internet of Things","IoT;blockchain as a service;decentralized ledger approach;distributed ledger approach;decentralized organization;distributed organization;device configuration management;sensor data storage;edge hosted blockchain;cloud hosted blockchain;fog computing","","","","","","","","","","IEEE","IEEE Conferences"
"Continuous Security in IoT Using Blockchain","R. Agrawal; P. Verma; R. Sonanis; U. Goel; A. De; S. A. Kondaveeti; S. Shekhar","Samsung Research Institute Bangalore; Samsung Research Institute Bangalore; Samsung Research Institute Bangalore; Samsung Research Institute Bangalore; Samsung Research Institute Bangalore; Samsung Research Institute Bangalore; Samsung Research Institute Bangalore","2018 IEEE International Conference on Acoustics, Speech and Signal Processing (ICASSP)","","2018","","","6423","6427","","","","10.1109/ICASSP.2018.8462513","","https://ieeexplore.ieee.org/stamp/stamp.jsp?arnumber=8462513","Internet of Things;blockchain;continuous security;digital crypto-token","Internet of Things;Cryptography;Markov processes;Predictive models;Data models","authorisation;Internet of Things","blockchain;IoT environment;continuous security;smart buildings;smart cities;IoT security solution;immutable nature;decentralized nature;valid IoT-Zone;user intervention;user interaction;IoT-trail;Internet of Things infrastructure","","","","","","","","","","IEEE","IEEE Conferences"
"AlkylVM: A Virtual Machine for Smart Contract Blockchain Connected Internet of Things","J. Ellul; G. J. Pace","NA; NA","2018 9th IFIP International Conference on New Technologies, Mobility and Security (NTMS)","","2018","","","1","4","","","","10.1109/NTMS.2018.8328732","","https://ieeexplore.ieee.org/stamp/stamp.jsp?arnumber=8328732","Blockchain;Internet of Things;Smart contracts;Virtual Machines;Distributed ledgers","Contracts;Virtual machining;Internet of Things;Performance evaluation;Computer architecture;Automation","contracts;Internet of Things;virtual machines","IoT devices;split-virtual machine;verifiable automation;blockchain systems;Internet-connected devices;verifiable digital processes;blockchain technology;smart contract blockchain;AlkylVM","","","","","","","","","","IEEE","IEEE Conferences"
"The applicability of blockchain in the Internet of Things","Y. Gupta; R. Shorey; D. Kulkarni; J. Tew","Department of Computer Science and Engineering, Indian Institute of Technology Delhi, New Delhi, India; Tata Consultancy Services (TCS) Innovation Labs, Tata Consultancy Services, India/USA; Tata Consultancy Services (TCS) Innovation Labs, Tata Consultancy Services, India/USA; Tata Consultancy Services (TCS) Innovation Labs, Tata Consultancy Services, India/USA","2018 10th International Conference on Communication Systems & Networks (COMSNETS)","","2018","","","561","564","","","","10.1109/COMSNETS.2018.8328273","","https://ieeexplore.ieee.org/stamp/stamp.jsp?arnumber=8328273","blockchain;IoT security;distributed consensus","Peer-to-peer computing;Security;Protocols;Internet of Things;Bandwidth;Computational modeling","Internet of Things;security of data","Blockchain consensus model;resource constrained devices;IoT security;data security;Internet of Things network;Blockchain technology","","","","","","","","","","IEEE","IEEE Conferences"
"Consortium Blockchain for Secure Energy Trading in Industrial Internet of Things","Z. Li; J. Kang; R. Yu; D. Ye; Q. Deng; Y. Zhang","College of Information Engineering, Xiangtan University, Xiangtan, Chian; School of AutomationGuangdong University of Technology; School of AutomationGuangdong University of Technology; School of AutomationGuangdong University of Technology; School of Information and Communication Engineering, Beijing University of Posts and Telecommunications, Beijing, China; University of Oslo, Norway","IEEE Transactions on Industrial Informatics","","2018","14","8","3690","3700","","","","10.1109/TII.2017.2786307","","https://ieeexplore.ieee.org/stamp/stamp.jsp?arnumber=8234700","Blockchain;energy trading;industrial Internet of things (IIoT);security and privacy;Stackelberg game","Peer-to-peer computing;Microgrids;Energy harvesting;Security;Servers;Pricing","data privacy;game theory;peer-to-peer computing;power engineering computing;power markets;power system security;pricing","privacy challenges;untrusted energy markets;nontransparent energy markets;security challenges;consortium blockchain technology;P2P energy trading;credit-based payment scheme;frequent energy trading;peer-to-peer energy trading;common security;Industrial Internet of Things;secure energy trading system","","","","","","","","","","IEEE","IEEE Journals & Magazines"
"Poster Abstract: Privacy in Blockchain-Enabled IoT Devices","A. Pouraghily; M. N. Islam; S. Kundu; T. Wolf","NA; NA; NA; NA","2018 IEEE/ACM Third International Conference on Internet-of-Things Design and Implementation (IoTDI)","","2018","","","292","293","","","","10.1109/IoTDI.2018.00045","","https://ieeexplore.ieee.org/stamp/stamp.jsp?arnumber=8367006","Blockchain;IOT;Privacy","Contracts;Cameras;Feeds;Privacy;Computer architecture;Hardware","contracts;data privacy;electronic money;financial data processing;Internet of Things","privacy;blockchain-enabled IoT devices;societal problems;IoT systems;hardware infrastructure;capital cost;architectural guideline;multiple blockchain ecosystems;blockchain smart contracts;Internet connectivity;IoT solutions","","","","","","","","","","IEEE","IEEE Conferences"
"Application of Blockchain Technology in Smart City Infrastructure","S. Li","NA","2018 IEEE International Conference on Smart Internet of Things (SmartIoT)","","2018","","","276","2766","","","","10.1109/SmartIoT.2018.00056","","https://ieeexplore.ieee.org/stamp/stamp.jsp?arnumber=8465562","Smart-City;Blockchain;Energy-Internet;Big-Data;Internet-of-Things","Internet of Things;Smart cities;Big Data;Cryptography","cryptography;data privacy;Internet;Internet of Things;peer-to-peer computing;smart cities;transportation","peer-to-peer characteristics;data center;Blockchain data storage;user privacy leakage;big data;IoT equipment;redundant storage;transparent interconnection;open interconnection;distributed P2P network common intelligence accounting technology;energy Internet users trust;data center construction;high operating costs;equipment maintenance;government affairs;intelligent solutions;smart city infrastructure;Blockchain technology","","","","","","","","","","IEEE","IEEE Conferences"
"Peer to Peer for Privacy and Decentralization in the Internet of Things","M. Conoscenti; A. Vetrò; J. C. De Martin","NA; NA; NA","2017 IEEE/ACM 39th International Conference on Software Engineering Companion (ICSE-C)","","2017","","","288","290","","","","10.1109/ICSE-C.2017.60","","https://ieeexplore.ieee.org/stamp/stamp.jsp?arnumber=7965333","privacy;internet of things;peer to peer;blockchain","Peer-to-peer computing;Bitcoin;Companies;Scalability;Data privacy;Internet of Things","data privacy;Internet of Things;peer-to-peer computing","Internet of Things;decentralized private-by-design IoT;personal IoT devices;privacy;peer-to-peer storage networks;blockchain","","","","","","","","","","IEEE","IEEE Conferences"
"A Blockchain Based New Secure Multi-Layer Network Model for Internet of Things","C. Li; L. Zhang","NA; NA","2017 IEEE International Congress on Internet of Things (ICIOT)","","2017","","","33","41","","","","10.1109/IEEE.ICIOT.2017.34","","https://ieeexplore.ieee.org/stamp/stamp.jsp?arnumber=8039052","Internet of things;Blockchain;Network model;Security","Cloud computing;Security;Distributed databases;Servers;Internet of Things;Data models;Performance evaluation","Internet of Things","block chain technology;high security;credibility assurance;blockchain technology;wide-area networking solution;secure multilayer network model;multilayer secure IoT network model;internet of things;multilevel decentric network","","","","","","","","","","IEEE","IEEE Conferences"
"Block chain based data security enhanced IoT server platform","J. H. Jeon; K. Kim; J. Kim","Graduate School of Ajou University, Knowledge Information Security, 206, World cup-ro, Yeongtong-gu, Suwon-si, Gyeonggi-do, Republic of Korea; Graduate School of Ajou University, 206, World cup-ro, Yeongtong-gu, Suwon-si, Gyeonggi-do, Republic of Korea; Graduate School of Ajou University, 206, World cup-ro, Yeongtong-gu, Suwon-si, Gyeonggi-do, Republic of Korea","2018 International Conference on Information Networking (ICOIN)","","2018","","","941","944","","","","10.1109/ICOIN.2018.8343262","","https://ieeexplore.ieee.org/stamp/stamp.jsp?arnumber=8343262","IoT;security;Database;Block Chain","Servers;Security;Contracts;Online banking;Internet of Things","Internet of Things;security of data;SQL","IoT server platform;real-time sensor data;Mysql server;Mysql's Mobius configuration;data storage method;server configuration method;data security;block chain based data security;server construction method","","","","","","","","","","IEEE","IEEE Conferences"
"A Self-Organized Framework for Insurance Based on Internet of Things and Blockchain","M. Vahdati; K. Gholizadeh HamlAbadi; A. M. Saghiri; H. Rashidi","NA; NA; NA; NA","2018 IEEE 6th International Conference on Future Internet of Things and Cloud (FiCloud)","","2018","","","169","175","","","","10.1109/FiCloud.2018.00032","","https://ieeexplore.ieee.org/stamp/stamp.jsp?arnumber=8458009","Internet of Things (IoT);Blockchain;Insurance;Cognitive System","Insurance;Companies;Engines;Contracts;Cryptography;Internet of Things","cognitive systems;contracts;cryptography;insurance;Internet;Internet of Things;risk management","Internet of things;blockchain technology;customers characteristics;low-risk customers;IoT technology;insurer;high-risk customers;insurance rates;insurance companies;self-organized framework","","","","","","","","","","IEEE","IEEE Conferences"
"On design issues and architectural styles for blockchain-driven IoT services","C. Liao; S. Bao; C. Cheng; K. Chen","Department of Computer Science, National Chengchi University, Taipei, Taiwan; Department of Computer Science, National Chengchi University, Taipei, Taiwan; Department of Computer Science, National Chengchi University, Taipei, Taiwan; Department of Computer Science, National Chengchi University, Taipei, Taiwan","2017 IEEE International Conference on Consumer Electronics - Taiwan (ICCE-TW)","","2017","","","351","352","","","","10.1109/ICCE-China.2017.7991140","","https://ieeexplore.ieee.org/stamp/stamp.jsp?arnumber=7991140","Blockchain;IoT;Smart Contract;Ethereum","Contracts;Peer-to-peer computing;Logic gates;Internet of Things;Distributed databases;Robustness","Internet of Things;software architecture;ubiquitous computing","design issues;architectural styles;blockchain-driven IoT services;smart living spaces;Internet of Things;innovative business models","","","","","","","","","","IEEE","IEEE Conferences"
"A Scalable Blockchain Framework for Secure Transactions in IoT","S. Biswas; K. Sharif; F. Li; B. Nour; Y. Wang","School of Computer Science, Beijing Institute of Technology, & Beijing Engineering Research Center of High Volume Language Information Processing and Cloud Computing Applications, Beijing, China.; School of Computer Science, Beijing Institute of Technology, & Beijing Engineering Research Center of High Volume Language Information Processing and Cloud Computing Applications, Beijing, China.; School of Computer Science, Beijing Institute of Technology, & Beijing Engineering Research Center of High Volume Language Information Processing and Cloud Computing Applications, Beijing, China.; School of Computer Science, Beijing Institute of Technology, & Beijing Engineering Research Center of High Volume Language Information Processing and Cloud Computing Applications, Beijing, China.; Department of Computer Science, University of North Carolina at Charlotte, NC, USA.","IEEE Internet of Things Journal","","2018","PP","99","1","1","","","","10.1109/JIOT.2018.2874095","","https://ieeexplore.ieee.org/stamp/stamp.jsp?arnumber=8481466","Internet of Things;Blockchain;Scalability;Security;Transaction rate;Ledger size.","Internet of Things;Scalability;Fabrics;Bitcoin","","","","","","","","","","","","IEEE","IEEE Early Access Articles"
"Softwarization of Internet of Things Infrastructure for Secure and Smart Healthcare","M. A. Salahuddin; A. Al-Fuqaha; M. Guizani; K. Shuaib; F. Sallabi","University of Waterloo; Western Michigan University; University of Idaho; United Arab Emirates University; United Arab Emirates University","Computer","","2017","50","7","74","79","","","","10.1109/MC.2017.195","","https://ieeexplore.ieee.org/stamp/stamp.jsp?arnumber=7971867","Internet of Things;IoT;softwarization;smart healthcare;fog;cloud;decision fusion;data fusion;rule-based engine;beacons;software-defined networking;SDN;network-functions virtualization;NFV;blockchain;Tor","Medical services;Logic gates;Cloud computing;Internet of Things;Machine-to-machine communications;Biomedical monitoring;Computer security;Cost accounting","data privacy;health care;Internet of Things;software prototyping","Internet of Things infrastructure;smart healthcare;secure healthcare;softwarized infrastructure;agile;privacy preserving deployment;Internet of Things systems","","","","","","","","","","IEEE","IEEE Journals & Magazines"
"Blockchain Meets IoT: An Architecture for Scalable Access Management in IoT","O. Novo","NomadicLab, Ericsson Research, Helsinki, Finland","IEEE Internet of Things Journal","","2018","5","2","1184","1195","","","","10.1109/JIOT.2018.2812239","","https://ieeexplore.ieee.org/stamp/stamp.jsp?arnumber=8306880","Access control;blockchain;Internet of Things (IoT);smart contracts","Access control;Internet of Things;Bitcoin;Peer-to-peer computing;Contracts","authorisation;Internet;Internet of Things","access management technology;fully distributed access control system;blockchain technology;realistic IoT scenarios;specific scalable IoT scenarios;scalable access management","","","","","","","","","","IEEE","IEEE Journals & Magazines"
"Blockchain-based Secure Time Protection Scheme in IoT","K. Fan; S. Wang; Y. Ren; K. Yang; Z. Yan; H. Li; Y. Yang","State Key Laboratory of Integrated Service Networks, Xidian University, Xi’an, 710071 China.; State Key Laboratory of Integrated Service Networks, Xidian University, Xi’an, 710071 China.; State Key Laboratory of Integrated Service Networks, Xidian University, Xi’an, 710071 China.; Department of Computer Science, University of Memphis, Memphis, TN 38152 USA.; State Key Laboratory of Integrated Service Networks, Xidian University, Xi’an, 710071 China.; State Key Laboratory of Integrated Service Networks, Xidian University, Xi’an, 710071 China.; Key Lab. of the Minist. of Educ. for Wide Band-Gap Semiconductor Materials and Devices, Xidian University, Xi’an, 710071 China.","IEEE Internet of Things Journal","","2018","PP","99","1","1","","","","10.1109/JIOT.2018.2874222","","https://ieeexplore.ieee.org/stamp/stamp.jsp?arnumber=8482304","Internet of Things;Time Synchronization;Blockchain;Security.","Synchronization;Protocols;Internet of Things;Robustness","","","","","","","","","","","","IEEE","IEEE Early Access Articles"
"Internet of Things and Blockchain: Legal Issues and Privacy. The Challenge for a Privacy Standard","N. Fabiano","NA","2017 IEEE International Conference on Internet of Things (iThings) and IEEE Green Computing and Communications (GreenCom) and IEEE Cyber, Physical and Social Computing (CPSCom) and IEEE Smart Data (SmartData)","","2017","","","727","734","","","","10.1109/iThings-GreenCom-CPSCom-SmartData.2017.112","","https://ieeexplore.ieee.org/stamp/stamp.jsp?arnumber=8276831","Internet of Things;Legal issues;Data Protection and privacy Law;Blockchain;Security;Risks;Legal framework;Privacy standard","Privacy;Law;Data protection;Security;Internet of Things","cryptography;data protection;Internet of Things;legislation","data protection law;privacy law;personal data;data security;European General Data Protection Regulation;data breach notification;Big Data;data protection activities;legal issues;Internet of Things;Blockchain;Privacy Standard;IoT","","","","","","","","","","IEEE","IEEE Conferences"
"Managing IoT devices using blockchain platform","S. Huh; S. Cho; S. Kim","ETRI, Daejeon, South Korea; ETRI, Daejeon, South Korea; ETRI, Daejeon, South Korea","2017 19th International Conference on Advanced Communication Technology (ICACT)","","2017","","","464","467","","","","10.23919/ICACT.2017.7890132","","https://ieeexplore.ieee.org/stamp/stamp.jsp?arnumber=7890132","Blockchain;IoT;Ethereum;Key Management;Information & Network Security;Authentication;Smart Contract","","Internet of Things;public key cryptography;Turing machines","Bitcoin;blockchain technology;Internet of Things;IoT;RSA public key cryptosystem;Ethereum;Turing-complete code;key management system","","","","","","","","","","IEEE","IEEE Conferences"
"Trust list: Internet-wide and distributed IoT traffic management using blockchain and SDN","K. Kataoka; S. Gangwar; P. Podili","Indian Institute of Technology Hyderabad, India; Indian Institute of Technology Hyderabad, India; Indian Institute of Technology Hyderabad, India","2018 IEEE 4th World Forum on Internet of Things (WF-IoT)","","2018","","","296","301","","","","10.1109/WF-IoT.2018.8355139","","https://ieeexplore.ieee.org/stamp/stamp.jsp?arnumber=8355139","","Servers;Peer-to-peer computing;Switches;Internet of Things","computer network management;computer network security;Internet;Internet of Things;software defined networking;telecommunication traffic;trusted computing","IoT traffic management;blockchain;SDN;IoT communications;IoT devices;edge networks;IoT service;application service providers;network operators;distributed manner;Trust List;software-defined networking","","","","","","","","","","IEEE","IEEE Conferences"
"Coin Hopping Attack in Blockchain-based IoT","S. Zhu; W. Li; H. Li; L. Tian; G. Luo; Z. Cai","Department of Computer Science, Georgia State University, Atlanta, GA, USA.; Department of Computer Science, Georgia State University, Atlanta, GA, USA.; Institute of Information Engineering, Chinese Academy of Sciences, Beijing, China.; School of Computer Science and Engineering, University of Electronic Science and Technology of China, Chengdu, Sichuan Province, P.R. China.; School of Computer Science and Engineering, University of Electronic Science and Technology of China, Chengdu, Sichuan Province, P.R. China.; Department of Computer Science, Georgia State University, Atlanta, GA, USA.","IEEE Internet of Things Journal","","2018","PP","99","1","1","","","","10.1109/JIOT.2018.2872458","","https://ieeexplore.ieee.org/stamp/stamp.jsp?arnumber=8473692","Internet of Things;blockchain;pool mining;Bitcoin;Ethereum;coin hopping attack.","Bitcoin;Internet of Things;Computer architecture;Protocols;Data mining","","","","","","","","","","","","IEEE","IEEE Early Access Articles"
"Work-in-progress: integrating low-power IoT devices to a blockchain-based infrastructure","K. R. Özyılmaz; A. Yurdakul","Bogazici University Bebek Istanbul 34342, Turkey; Bogazici University Bebek Istanbul 34342, Turkey","2017 International Conference on Embedded Software (EMSOFT)","","2017","","","1","2","","","","10.1145/3125503.3125628","","https://ieeexplore.ieee.org/stamp/stamp.jsp?arnumber=8094378","IoT;Blockchain;LPWAN;LoRa;Ethereum;trustless;decentralized","Logic gates;Contracts;Peer-to-peer computing;Software;Protocols;Security;Servers","Internet of Things;internetworking","low-power IoT devices;blockchain-based infrastructure;scalable infrastructure;low-power IoT end-devices;intensive blockchain calculations;IoT gateway;blockchain node;gateway;LoRa nodes;private Ethereum network;event-based messaging mechanism","","","","","","","","","","IEEE","IEEE Conferences"
