Reference Type,Author,Title,Year,Secondary Title,DOI,URL,Abstract,Keywords,Label
Article,Zhao Y.; Liu Y.; Tian A.; Yu Y.; Du X.,Blockchain based privacy-preserving software updates with proof-of-delivery for Internet of Things,2019,Journal of Parallel and Distributed Computing,10.1016/j.jpdc.2019.06.001,https://www.scopus.com/inward/record.uri?eid=2-s2.0-85067258270&doi=10.1016%2fj.jpdc.2019.06.001&partnerID=40&md5=d2d6d0440abf771ebd5118d2deee0d4f,"A large number of IoT devices are connected via the Internet. However, most of these IoT devices are generally not perfect-by-design even have security weaknesses or vulnerabilities. Thus, it is essential to update these IoT devices securely, patching their vulnerabilities and protecting the safety of the involved users. Existing studies deliver secure and reliable updates based on blockchain network which serves as the transmission network. However, these approaches could compromise users privacy when updating the IoT devices. In this paper, we propose a new blockchain based privacy-preserving software update protocol, which delivers secure and reliable updates with an incentive mechanism while protects the privacy of involved users. A vendor delivers the updates and makes a commitment by using smart contract to provide financial incentive to the transmission nodes who deliver the updates to its IoT devices. A transmission node can get financial incentive by providing a proof-of-delivery. In order to obtain the proof-of-delivery, the transmission node uses double authentication preventing signature (DAPS) to carry out fair exchange. Specifically, the transmission node uses the DAPS to exchange an attribute-based signature (ABS) of one IoT device. Then, it uses the ABS as proof-of-delivery to receive financial incentives. Generally, to generate an ABS, the IoT device has to execute complex computations which is intolerable for resource limited devices. We propose a concrete outsourced attribute-based signature (OABS) scheme to overcome the weakness. Then, we prove the security of the proposed OABS and the protocol. Finally, we implement smart contract in Solidity to demonstrate the validity of the proposed protocol. © 2019 Elsevier Inc.",Attribute-based signatures; Blockchain; IoT; Privacy-preserving; Software update,Zhao:2019:1
Conference Proceedings,Da Silva V.F.; Coelho M.N.; Coelho B.N.; Coelho V.N.; Coelho I.M.,A home ledger approach for IoT enabled devices,2019,Proceedings - Symposium on Computer Architecture and High Performance Computing,10.1109/SBAC-PAD.2019.00044,https://www.scopus.com/inward/record.uri?eid=2-s2.0-85076932294&doi=10.1109%2fSBAC-PAD.2019.00044&partnerID=40&md5=863b23cb56bcf84ac1beae820b2212b4,"This paper discusses the application of IoT-devices with low energy consumption and high-performance computing capabilities, for processing blockchain data using Neo Virtual Machine (NeoVM). NeoVM is a turing-complete computing machine, designed for Neo Blockchain, specially designed for cryptographic and deterministic (verifiable) computation. A NeoVM program is called a NVM Script (or just Script), and it is often used together with Neo Blockchain application capabilities, being called a Smart Contract. Smart Contracts are already used on other blockchains such as Bitcoin (although not Turing-complete) for value transfers, through the availability of verifiable information, i.e., transactions and transaction blocks, on a global ledger. However, due to the high processing costs and low throughput capabilities of global public chains, most industrial applications of blockchain require the usage of private/permissioned chains, with the goal of providing high-speed and low-cost information persistance. This work proposes an IoT device prototype capable of delivering blockchain private access to home applications (also called a Smart Home), in a new concept defined as Home Ledger. Applications of Home Ledger include: local permissioned access to sensors and home devices (through state-of-the-art cryptography); guaranteed verification of local stored data (through redundancy and byzantine fault tolerance consensus mechanisms); lowcost and high-performance local registry (through usage of lowenergy microcontrollers); auditable cameras and local security on Home Ledger; global availability by interfacing with a global public ledger. © 2019 IEEE.",Elliptic Curve Cryptography; Home Ledger; Microcontroller; NEO Blockchain; NeoVM; Smart Home,Da:2019:1
Article,Wu H.-T.; Tsai C.-W.,An intelligent agriculture network security system based on private blockchains,2019,Journal of Communications and Networks,10.1109/JCN.2019.000043,https://www.scopus.com/inward/record.uri?eid=2-s2.0-85072970758&doi=10.1109%2fJCN.2019.000043&partnerID=40&md5=8382490d61f26eee51fa18232d621f3b,"Countries around the world are nowadays actively promoting development in intelligent agriculture. Each of them must develop a specific plan tailored to environmental farming indices of each individual farm, and such information would be both important and sensitive. This is why information in intelligent agriculture requires protection from network security to ensure data privacy and integrity. This study proposes applying dark web technology to ensure the privacy of blockchains and servers. The study will monitor packet transmission frequency in intelligent agriculture to prevent distributed denial-of-service (DDOS) attacks. The main features of system include: (1) An identity authentication mechanism, (2) secure transmission of information, (3) establishment of private blockchains, (4) a faster, improved authentication system for blockchain information, and (5) resistance against DDOS attacks. The proposed scheme can safeguard network security for the IoT as well as the servers by way of applying dark web technology, which can avoid exposure of blockchains and server ID addresses and thus in turn lower the risks of DDOS attack damages. Experiment results indicate that the application of lightweight encryption of proposed scheme does indeed improve the authentication speed while also satisfying requirements of network security. © 2011 KICS.",Blockchain; intelligent agriculture; internet of things; network security; privacy,Wu:2019:1
Article,Zhang K.; Zhu Y.; Maharjan S.; Zhang Y.,Edge Intelligence and Blockchain Empowered 5G beyond for the Industrial Internet of Things,2019,IEEE Network,10.1109/MNET.001.1800526,https://www.scopus.com/inward/record.uri?eid=2-s2.0-85073633889&doi=10.1109%2fMNET.001.1800526&partnerID=40&md5=6ccb29c029b835c50e20cb1a8a52cb18,"Edge intelligence is a key enabler for IIoT as it offers smart cloud services in close proximity to the production environment with low latency and less cost. The need for ubiquitous communication, computing, and caching resources in 5G beyond will lead to a growing demand to integrate heterogeneous resources into the edge network. Furthermore, distributed edge services can make resource transactions vulnerable to malicious nodes. Ensuring secure edge services under complex industrial networks is a big challenge. In this article, we present an edge intelligence and blockchain empowered IIoT framework, which achieves flexible and secure edge service management. Then we propose a cross-domain sharing inspired edge resource scheduling scheme and design a credit-differentiated edge transaction approval mechanism. Numerical results indicate that the proposed schemes bring significant improvement in both edge service cost and service capacities. © 1986-2012 IEEE.",,Zhang:2019:1
Article,Ali G.; Ahmad N.; Cao Y.; Asif M.; Cruickshank H.; Ali Q.E.,Blockchain based permission delegation and access control in Internet of Things (BACI),2019,Computers and Security,10.1016/j.cose.2019.06.010,https://www.scopus.com/inward/record.uri?eid=2-s2.0-85068480555&doi=10.1016%2fj.cose.2019.06.010&partnerID=40&md5=865155c993c6ef2e0543084c28917391,"Access control with permission delegation mechanism allows fine granular access to secure resources. In the literature, existing architectures for permission delegation and access control are either event-based or query-based. These previous works assume a single trusted delegation service, which however is likely biased or fails to service. Also, they fail to allow users to verify delegation service operations, as such cannot be directly applied to IoT (Internet of Things) due to low power, low-bandwidth, ad-hoc and decentralized nature. This paper proposes a novel decentralized architecture for permission delegation and access control for IoT application, with demands on event and query base permission delegation. We further apply Blockchain (BC) technology to make delegation services secure, trusted, verifiable and decentralized. We investigate our proposed approach in Simple PROMELA INterpreter (SPIN) model checker using PROMELA (Process Meta Language). The “Platform Verification”, “Delegation”, “Mutual Exclusion” properties written in Linear Temporal Logic (LTL) are also verified against the PROMELA model. © 2019 Elsevier Ltd",Access control; Blockchain; Internet of Things; Permission delegation; Platform verification,Ali:2019:1
Conference Proceedings,Yusuf A.A.; Kurnia Basuki D.; Sukaridhoto S.; Pratama Y.P.; Bramasta Putra F.; Yulianus H.,ArmChain - A Blockchain Based Sensor Data Communication for the Vehicle as a Mobile Sensor Network,2019,"IES 2019 - International Electronics Symposium: The Role of Techno-Intelligence in Creating an Open Energy System Towards Energy Democracy, Proceedings",10.1109/ELECSYM.2019.8901530,https://www.scopus.com/inward/record.uri?eid=2-s2.0-85075832712&doi=10.1109%2fELECSYM.2019.8901530&partnerID=40&md5=40f99c0f899e3d96d846c88dc6ec7609,"The Internet of Things (IoT) is widely used in various aspects such as industry, manufacturing, health, agriculture and others. One of the uses of IoT is as an environmental monitoring system. In its application, IoT-based environmental monitoring systems are composed of one or more sensors placed in various locations and connected to each other using certain protocols. The problem arises when thousands of IoT devices connected together in one network and using the server-client connection model which raises several works in the synchronization process and access control management. This kind of network depends on a server as the center of control management that work as storing and distributing data from the sensor so that any data comes from the server is considered correct. To overcome this problem, it is proposed an IoT system that uses Blockchain technology which is a distributed data structure that forms blocks that do not require central authority and verification from third parties. From the experiments conducted can be evaluated that blockchain communication is much slower compared to MQTT communication protocol in terms of speed. The data transmission between node is measured with an average delay of 200ms. This system also visualizes data in graph with a high mobility data collection using vehicle so that it can be used to be an alternative of public participatorial measurement. © 2019 IEEE.",Air Quality Measurements; Blockchain; Distributed Network; Internet of Things; Vehicle as a Mobile Sensor Network,Yusuf:2019:1
Conference Proceedings,Pham H.-A.; Le T.-K.; Pham T.-N.-M.; Nguyen H.-Q.-T.; Le T.-V.,Enhanced Security of IoT Data Sharing Management by Smart Contracts and Blockchain,2019,"Proceedings - 2019 19th International Symposium on Communications and Information Technologies, ISCIT 2019",10.1109/ISCIT.2019.8905219,https://www.scopus.com/inward/record.uri?eid=2-s2.0-85076201861&doi=10.1109%2fISCIT.2019.8905219&partnerID=40&md5=210720604b58ac190321252575a9173b,"In recent years, the incredible growth and diversity of IoT systems and applications have generated an enormous amount of sensing data which play an essential role in IoT-based smart systems. So far, it has consumed much time and cost to collect these sensing data enough for these intelligent systems, which is the main reason leading to the needs of sharing available data to shorten time-consuming and cost savings for the data collection process. However, there are many challenges in ensuring integrity, security, and fairness in the data sharing process. In this paper, the authors propose a model leveraging the emerging Blockchain technology as an alternative solution to enhance the security of IoT data sharing management in terms of three principal criteria including confidentiality, integrity, and availability. Our prototype on Ethereum Blockchain demonstrates the feasibility of the proposed model. © 2019 IEEE.",Blockchain; Data Integrity; Data Security; IoT; IoT Data Management; Smart Contract,Pham:2019:1
Conference Proceedings,Loupos K.; Caglayan B.; Papageorgiou A.; Starynkevitch B.; Vedrine F.; Skoufis C.; Christofi S.; Karakostas B.; Mygiakis A.; Theofilis G.; Chiappetta A.; Avgoustidis H.; Boulougouris G.,"Cognition enabled IoT platform for industrial IoT safety, security and privacy-the CHARIOT project",2019,"IEEE International Workshop on Computer Aided Modeling and Design of Communication Links and Networks, CAMAD",10.1109/CAMAD.2019.8858488,https://www.scopus.com/inward/record.uri?eid=2-s2.0-85073792739&doi=10.1109%2fCAMAD.2019.8858488&partnerID=40&md5=274a82e60217ce936a374f6401b3b6b1,"The CHARIOT project is developing an innovative design method and cognitive platform that supports a unified and integrated approach towards Data Privacy, Security and Safety of Industrial IoT Systems including several technologies. These include: i) an advanced Privacy and security protection building on state of the art Public Key Infrastructure (PKI) technologies, ii) a blockchain ledger that provides categorization and affirmation of IoT physical, operational and functional changes, iii) a FOG-based decentralized infrastructure for Firmware Security integrity, iv) an IoT Safety Supervision Engine towards securing IoT data, devices and functionality in new and existing industry-specific safety critical systems, v) a cognitive System and Method with accompanying supervision, analytics and prediction models enabling high security and integrity of Industrials IoT as well as vi) new methods and tools for static code analysis of IoT devices. This short paper provides an overview of the above technologies as currently being integrated in the CHARIOT project. © 2019 IEEE.",Cognition; Data Privacy; Industrial IoT; Safety; Security,Loupos:2019:1
Article,Li Z.; Yang Z.; Xie S.; Chen W.; Liu K.,Credit-Based Payments for Fast Computing Resource Trading in Edge-Assisted Internet of Things,2019,IEEE Internet of Things Journal,10.1109/JIOT.2019.2908861,https://www.scopus.com/inward/record.uri?eid=2-s2.0-85066292107&doi=10.1109%2fJIOT.2019.2908861&partnerID=40&md5=a619fbb2e85eea186cdf802aaaedce5c,"The introduction of edge computing into blockchain-enabled Internet of Things (IoT) for offloading computational tasks is attracting increasing attention. Computing resource trading unavoidably happens in edge-assisted IoT. However, efficient computing resource trading cannot be achieved because of the 'cold start' and 'long return' problems. To address these challenges, we propose to use a credit-based payment for fast computing resource trading in edge-assisted blockchain-enabled IoT; therefore, the IoT nodes can finish fast payment and frequent trading by borrowing resource coins from other IoT nodes based on their credit values. In our resource-coin loan problem, we propose an iterative double-auction-based algorithm, where a broker is introduced to solve the loan allocation problem and to determine the size of the loan each lender would provide to each borrower. Furthermore, the broker enforces specific loan pricing rules to induce the borrowers and lenders to bid truthfully. Then, the hidden privacy information could be extracted to achieve the optimal resource-coin allocation and loan pricing. The proposed algorithm can maximize the economic benefits while protecting privacy. Simulations showed that the proposed algorithm can maximize social welfare. In addition, we compared the proposed algorithm with the credit-bank-based method in terms of the satisfaction function and payments. The experimental results demonstrated that the proposed algorithm was individually rational, truthful, and budget-balanced. © 2014 IEEE.",Computing resource trading; double auction; edge computing; Internet of Things (IoT); loan,Li:2019:1
Article,Viriyasitavat W.; Da Xu L.; Bi Z.; Sapsomboon A.,New blockchain-based architecture for service interoperations in internet of things,2019,IEEE Transactions on Computational Social Systems,10.1109/TCSS.2019.2924442,https://www.scopus.com/inward/record.uri?eid=2-s2.0-85069904891&doi=10.1109%2fTCSS.2019.2924442&partnerID=40&md5=45f89d436271378eaa874304151ca971,"Internet of Things (IoT) is able to integrate the computation and physical processes as services in the social world. The number of services at the edge of IoT is rising rapidly due to the prevalent uses of smart devices and cyber-physical systems (CPSs). To explore the promising applications of IoT services, one of the challenges is to enable the interoperability of the services in a decentralized environment. The blockchain technology (BCT) has been proven as a promising solution to establish the trust of data and call for executions; theoretically, it can be used to support the interoperability of services. BCT verifies data or a process and stores it as a transaction in a distributed ledger. Similar to the topology to IoT, applying BCT at the edges of the network exhibits the distributed characteristic. However, currently, BCT is still facing the challenges for interoperability due to a number of factors such as consensus protocols, block sizes, and interval of blocks. Prominent protocols such as proof-of-work (PoW) may cause excessive delays in finality settlement. One promising protocol Practical Byzantine Fault Tolerant offers a fast finality settlement and uses hyperledger to support the scalability; however, the trust might also be a concern if the validators are chosen improperly. This paper discusses the interoperability of IoT services and the challenges and proposes an architecture solution by integrating BCT, service-oriented architecture (SoA), and enablers of key performance indicators (KPIs) and service selections. The proposed architecture aims to solve both interoperability and trust issues for IoT services. The feasibility of the proposed method is validated by the examples of smart contract implementations. © 2019 IEEE.",and services; architecture; Blockchain technology (BCT); consensus; cyber-physics system; distributed system; Internet of Things (IoT); smart contract,Viriyasitavat:2019:1
Conference Proceedings,Cui H.; Chen Z.; Xi Y.; Chen H.; Hao J.,IoT data management and lineage traceability: A blockchain-based solution,2019,"2019 IEEE/CIC International Conference on Communications Workshops in China, ICCC Workshops 2019",10.1109/ICCChinaW.2019.8849969,https://www.scopus.com/inward/record.uri?eid=2-s2.0-85073594592&doi=10.1109%2fICCChinaW.2019.8849969&partnerID=40&md5=3ce7b46d92b5422ff248bed173d6a9fb,"The Internet of Things is stepping out of its infancy into full maturity, requiring massive data processing and storage. Unfortunately, because of the unique characteristics of resource constraints, short-range communication, and self-organization in IoT, it always resorts to the cloud or fog nodes for outsourced computation and storage, which has brought about a series of novel challenging security and privacy threats. For this reason, one of the critical challenges of having numerous IoT devices is the capacity to manage them and their data. A specific concern is from which devices or Edge clouds to accept join requests or interaction requests. This paper discusses a design concept for developing the IoT data management platform, along with a data management and lineage traceability implementation of the platform based on blockchain and smart contracts, which approaches the two major challenges: how to implement effective data management and enrich rational interoperability for trusted groups of linked Things; And how to settle conflicts between untrusted IoT devices and its requests taking into account security and privacy preserving. Experimental results show that the system scales well with the loss of computing and communication performance maintaining within the acceptable range, works well to effectively defend against unauthorized access and empower data provenance and transparency, which verifies the feasibility and efficiency of the design concept to provide privacy, fine-grained, and integrity data management over the IoT devices by introducing the blockchain-based data management platform. © 2019 IEEE.",Blockchain; Data Management; Internet of Things (IoT); Privacy,Cui:2019:1
Article,Chaudhary R.; Jindal A.; Aujla G.S.; Aggarwal S.; Kumar N.; Choo K.-K.R.,BEST: Blockchain-based secure energy trading in SDN-enabled intelligent transportation system,2019,Computers and Security,10.1016/j.cose.2019.05.006,https://www.scopus.com/inward/record.uri?eid=2-s2.0-85066274740&doi=10.1016%2fj.cose.2019.05.006&partnerID=40&md5=81f4d4161c9296321cc401c2213c62c8,"Tactile Internet is a fairly recent technological trend associated with the Internet-of-Things (IoT)era, with potential applications in a broad range of industrial, societal and business use cases. The real-time machine-to-machine and human-to-machine interactions (e.g., in unmanned vehicles and the underpinning infrastructure within the smart city ecosystem)in the intelligent transportation sector, for example, contribute to the potential utility of Tactile Internet in this particular sector (and the broader smart city). In the context of unmanned vehicles, such as unmanned aerial vehicles and electric (ground)vehicles, one of several key challenges to its broader utility is how to design a secure energy trading ecosystem that can be used for purposes such as charging and discharging from the supporting smart grids. Most existing approaches in the literature focused on conventional and centralized security mechanisms, which may not be applicable for energy trading in a smart city environment. Moreover, the need for real-time processing for energy trading computation is one of the essential requirements of Tactile Internet. Therefore, to address these challenges, BEST: a Blockchain-based secure energy trading scheme for electric vehicles (EVs)is proposed in this paper. Specifically, in BEST, blockchain is used to validate EVs’ requests in a distributed manner; thus, ensuring resilience against the single point of failure. The miner nodes are selected to validate the requests on the basis of energy requirements, time of stay, dynamic pricing, and connectivity record, as well as other factors that are crucial for the operator at the time of operation. Moreover, to provide low latency and real-time services, software-defined networking is used as the network's backbone to transfer EVs’ requests to a global software defined network controller. Finally, BEST is evaluated on the basis of the communication and computation costs incurred during various transactions between the EVs and the smart grid. A case study is also provided to demonstrate the potential deployment of BEST in energy trading. © 2019 Elsevier Ltd",5G; Blockchain; Energy trading; Intelligent transportation system; Smart city; Smart nation; Software-defined networking; Tactile Internet,Chaudhary:2019:1
Conference Proceedings,Rahman M.A.; Rashid M.M.; Barnes S.J.; Abdullah S.M.,A Blockchain-based Secure Internet of Vehicles Management Framework,2019,"2019 UK/China Emerging Technologies, UCET 2019",10.1109/UCET.2019.8881874,https://www.scopus.com/inward/record.uri?eid=2-s2.0-85074915610&doi=10.1109%2fUCET.2019.8881874&partnerID=40&md5=70efad957a7ec1bd32741abeca1f0eea,"In this paper, we propose a secure internet of vehicles (IoV) framework that can handle the transportation ecosystem of a very large and dynamic crowd. The framework will allow personalized and location-aware vehicle IoT data to store in blockchain and off-chain repositories for secure sharing with one's community of interest. As a test case of our proposed application, we have developed distributed smartphone applications that can be interfaced with the OBD-II interface to collect in-vehicle data from the CAN bus of a vehicle and an ambient intelligent environment consisting of IoT devices. The in-vehicle environment can collect vehicle sensory information, process the sensory data within the mobile edge network and store the transactions and the raw sensory data to blockchain and off-chain repositories through secure digital wallets. Finally, we will present our implemented framework and initial test results. © 2019 IEEE.",blockchain; internet of vehicles; off-chain,Rahman:2019:1
