Reference Type,Author,Title,Year,Secondary Title,DOI,URL,Abstract,Keywords,Label
Conference Proceedings,Pinjala S.K.; Sivalingam K.M.,DCACI: A decentralized lightweight capability based access control framework using iota for internet of things,2019,"IEEE 5th World Forum on Internet of Things, WF-IoT 2019 - Conference Proceedings",10.1109/WF-IoT.2019.8767356,https://www.scopus.com/inward/record.uri?eid=2-s2.0-85073911895&doi=10.1109%2fWF-IoT.2019.8767356&partnerID=40&md5=d53c777edc8ef8a81188a28026524424,"Security and Privacy are some of the important aspects to be considered in the large-scale deployment of Internet of Things (IoT) systems. Due to the large number of IoT devices and the different administrative domains in which they operate, traditional approaches involving a Centralized server for managing Authorizations will not be scalable or efficient. In this paper, we propose a Decentralized Capability-Based Access Control framework using IOTA (DCACI); IOTA is an open-source distributed ledger that enables fee-less micro transactions for the IoT. The DCACI framework enables complete privacy and integrity of the Capability tokens using IOTA's Masked Authenticated Messaging (MAM) technology. It enables device owners and users to Grant, Update, Delegate and Revoke the capability tokens. The proposed DCACI framework has been implemented as a proof-of-concept on a resource constrained machine; the results indicate that it is capable of scaling up to large-scale infrastructure such as a Smart City, having millions of IoT devices. © 2019 IEEE.",Blockchain; Capability Based Access Control; Internet of Things.; IOTA,Pinjala:2019:1
Conference Proceedings,Javaid U.; Aman M.N.; Sikdar B.,DrivMan: Driving trust management and data sharing in VANETs with blockchain and smart contracts,2019,IEEE Vehicular Technology Conference,10.1109/VTCSpring.2019.8746499,https://www.scopus.com/inward/record.uri?eid=2-s2.0-85068782025&doi=10.1109%2fVTCSpring.2019.8746499&partnerID=40&md5=902dc5c49a7f512a302eb3df90c9704a,"The development of Internet of Things (IoT) has paved way for the Internet of Vehicles (IoV) and intelligent transportation systems (ITS). Vehicular ad-hoc networks (VANETs) are indispensable for ITS with intelligent vehicles (IV) as their key players. To ensure proper and reliable VANET operation, IVs need secure inter- and intra-network communication with trust and reliability of data (provenance). This paper aims to provide trust management in VANETs by proposing a trustless system model using blockchain and a certificate authority (CA) for registering IVs as well as revoking their registration if need be. Furthermore, to preserve data reliability, this paper uses physical unclonable functions (PUFs). Implementation of DrivMan shows that it is able to establish distributed trust management and enables secure data sharing while preserving the privacy of IVs. © 2019 IEEE.",Blockchain; Certificate authority (CA); Intelligent transportation system (ITS); Physical unclonable function (PUF); Smart contract; Vehicular ad-hoc network (VANET),Javaid:2019:1
Conference Proceedings,Boussard M.; Papillon S.; Peloso P.; Signorini M.; Waisbard E.,STewARD:SDN and blockchain-based Trust evaluation for Automated Risk management on IoT Devices,2019,"INFOCOM 2019 - IEEE Conference on Computer Communications Workshops, INFOCOM WKSHPS 2019",10.1109/INFCOMW.2019.8845126,https://www.scopus.com/inward/record.uri?eid=2-s2.0-85073250918&doi=10.1109%2fINFCOMW.2019.8845126&partnerID=40&md5=fa5927a6f135a3a49232aa4a456fbe6a,"The Internet of Things (IoT) carries a big promise, to improve our lives through numerous connected devices that interact with one another. Unfortunately, some of these devices are of questionable security, becoming targets of choice for numerous exploits. This can result in compromising the home network, as well as large scale attacks such as the recent Mirai network of botnets that was used in a DDoS attack. The problem is that end users have a hard time assessing the risks induced by connected devices, and often lack the skills and time to administrate their home network. We answer the above challenge by proposing STewARD, a solution that allows users to easily request from their intelligent home network controller the creation of isolated software-defined network slices, to which they assign a required trust level using very simple risk assessment. We build a global trust assessment framework that computes a trust score for each class of devices, based on reported history stored in a blockchain. Network controllers can then leverage this information to connect to slices only those devices that meet the expected trust levels, and can contribute to the crowd-sourced reporting by monitoring the devices' behaviors compared to an expected baseline. © 2019 IEEE.",Access Control; Blockchain; Distributed Ledger; Home networking; Internet of Things; Risk management; Security; Software-Defined Networking; Trust,Boussard:2019:1
Article,Singh S.; Ra I.-H.; Meng W.; Kaur M.; Cho G.H.,SH-BlockCC: A secure and efficient Internet of things smart home architecture based on cloud computing and blockchain technology,2019,International Journal of Distributed Sensor Networks,10.1177/1550147719844159,https://www.scopus.com/inward/record.uri?eid=2-s2.0-85064924630&doi=10.1177%2f1550147719844159&partnerID=40&md5=aad7f036c39551554f38aba9e6772ea3,"The growing demand for human-independent comfortable lifestyle has emboldened the development of smart home. A typical keenly intellective home includes many Internet of things contrivances that engender processes and immensely colossal data to efficiently handle its users’ demands. This incrementing demand raises a plethora of concern cognate to a smart home system in terms of scalability, efficiency, and security. All these issues are tedious to manage, and the existing studies lack the granularity for surmounting them. Considering such a requisite of security and efficiency as a quandary at hand, this article presents a secure and efficient smart home architecture, which incorporates the blockchain and the cloud computing technologies for a cumulated solution. Because of the decentralized nature of blockchain technology, it can serve the processing services and make the transaction copy of the collected sensible user data from smart home. To ensure the security of smart home network, our proposed model utilizes the multivariate correlation analysis technique to analyze the network traffic and identify the correlation between traffic features. We have evaluated the performance of our proposed architecture using different parameters like throughput and discovered that blockchain is an efficient security solution for the future Internet of things network. © The Author(s) 2019.",blockchain; cloud computing; Internet of things; security attacks,Singh:2019:1
Conference Proceedings,Fan C.; Khazaei H.; Chen Y.; Musilek P.,Towards a scalable dag-based distributed ledger for smart communities,2019,"IEEE 5th World Forum on Internet of Things, WF-IoT 2019 - Conference Proceedings",10.1109/WF-IoT.2019.8767342,https://www.scopus.com/inward/record.uri?eid=2-s2.0-85073899959&doi=10.1109%2fWF-IoT.2019.8767342&partnerID=40&md5=7902d275fc1ec54038a8be10426190fe,"In recent years, Distributed Ledger Technology (DLT) has been playing a more and more important role in building trust and security for Internet of Things (IoT). However, the unacceptable performance of the current mainstream DLT systems such as Bitcoin can hardly meet the efficiency and scalability requirements of IoT. In this paper, we propose a scalable transactive smart homes infrastructure by leveraging a Directed Acyclic Graph (DAG) based DLT and following the separation of concerns (SOC) design principle. Based on the proposed solution, an experiment with 40 Home Nodes is conducted to prove the concepts. From the results, we find that our solution provides a high transaction speed and scalability, as well as good performance on security and micropayment which are important in IoT settings. Then, we conduct an analysis and discuss how the new system breaks out the well-known Trilemma, which claims that it is hard for a DLT platform to simultaneously reach decentralization, scalability and security. Finally, we conclude that the proposed DAG-based distributed ledger is an effective solution for building an IoT infrastructure for smart communities. © 2019 IEEE.",Blockchain; DAG; Distributed Leger; Energy Transaction; Internet of Things; Smart Community; Smart Home,Fan:2019:1
Conference Proceedings,Wrona K.; Jarosz M.,Use of blockchains for secure binding of metadata in military applications of IoT,2019,"IEEE 5th World Forum on Internet of Things, WF-IoT 2019 - Conference Proceedings",10.1109/WF-IoT.2019.8767315,https://www.scopus.com/inward/record.uri?eid=2-s2.0-85073907830&doi=10.1109%2fWF-IoT.2019.8767315&partnerID=40&md5=700c10715e5bf5c4cba88cb1d08c699e,"Blockchains offer an interesting solution to some of the security challenges encountered in military applications. They are particularly attractive in the scenarios, where it is difficult or even impossible to establish a common root of trust, e.g., in the context of civil-military collaboration, where military organizations need to build trusted information exchange infrastructure with various types of civilian governmental and non-governmental organizations, local communities, commercial companies and private persons. In our work, we discuss how blockchain can be used to store metadata describing information collected from the IoT devices owned by the federation members as well as crowdsourced from sensors belonging to private users. We present a high level architecture for a metadata binding solution using blockchains compliant with STANAG 4774 and 4778. We also describe a concrete technical solution based on Hyperledger Fabric and some of the open issues. © 2019 IEEE.",,Wrona:2019:1
Conference Proceedings,Tantidham T.; Aung Y.N.,Emergency Service for Smart Home System Using Ethereum Blockchain: System and Architecture,2019,"2019 IEEE International Conference on Pervasive Computing and Communications Workshops, PerCom Workshops 2019",10.1109/PERCOMW.2019.8730816,https://www.scopus.com/inward/record.uri?eid=2-s2.0-85068013694&doi=10.1109%2fPERCOMW.2019.8730816&partnerID=40&md5=de315909c741169dbb2252f36edf6e7f,"Due to emerging disruptive technologies, Internet of Things (IoT) play a vital role for smart living domains, for examples, elderly and disabilities healthcare services and home safety and security monitoring and automation control services. These systems will send automatically an emergency call with home user information and location as a privacy data to public services like hospitals, police offices, or fire departments. This paper introduces emergency service for a Smart Home System (SHS) based on Ethereum blockchain with smart contract for decentralized handling access control among untrusted public services so called Home Service Providers (HSPs) and smart home IoT devices. Our SHS testbed consists of (1) smart home sensor manger equipped with Raspberry Pi (RPi) represented as an edge IoT gateway for gathering environmental sensor data, (2) HSP miners deployed Meteor and Ethereum platform, and (3) web-based applications for home users and HSP staffs. Furthermore, our contribution includes the integration of digital signature for the IoT device authentication, the One Time Passcode with QR code for HSP staff access control, and IPFS for manipulating emergency call from SHS in peers. Our implementation results focusing on HSP miners will be presented and analysed. © 2019 IEEE.",Emergency; Ethereum; Internet of Things (IoT); IPFS; One Time Passcode; Private Blockchain; Smart Contract; Smart Home,Tantidham:2019:1
Conference Proceedings,Pillai A.; Sindhu M.; Lakshmy K.V.,Securing Firmware in Internet of Things using Blockchain,2019,"2019 5th International Conference on Advanced Computing and Communication Systems, ICACCS 2019",10.1109/ICACCS.2019.8728389,https://www.scopus.com/inward/record.uri?eid=2-s2.0-85067921371&doi=10.1109%2fICACCS.2019.8728389&partnerID=40&md5=f445e45ae9d1e8b17b0b5ca1f8c27975,"As of today, most of the Internet of Things (IoT) devices work in a centralized environment. With IoT devices having to execute thousands of operations per second, it has become difficult for centralized systems to handle such platforms. Also, factors like operational and maintenance cost of these server machines and danger of DoS(Denial of Service) attack on such servers has threatened the practitioners to come up with a more distributed way of storing the contents. With its decentralized and privacy preserving features, blockchain technology fits well into the scheme of things. This mitigates the quintessential challenges faced in most of the centralized systems. In this paper, we are focusing on the new firmware update scheme to perform the update operations securely. We propose a blockchain based solution for managing firmware updates in IoT. Improper management of devices and distribution of firmware updates from the device vendor could sabotage the IoT ecosystem. The objective of this proposed scheme is to verify and distribute the firmware binaries securely to the IoT device deployed by the device vendor. The PUSH-based method is used for a firmware update in which verification of firmware is done by Hash Chain. It preserves the integrity of firmware by linking the latest version information by previous versions information with the help of a smart contract mechanism. © 2019 IEEE.",Blockchain; Firmware Update; Internet of Things; Smart Contracts,Pillai:2019:1
Conference Proceedings,Asare B.T.; Quist-Aphetsi K.; Nana L.,Nodal Authentication of IoT Data Using Blockchain,2019,"Proceedings - 2019 International Conference on Computing, Computational Modelling and Applications, ICCMA 2019",10.1109/ICCMA.2019.00028,https://www.scopus.com/inward/record.uri?eid=2-s2.0-85068824624&doi=10.1109%2fICCMA.2019.00028&partnerID=40&md5=83d1665891c79e561b0b6b6b8d46b97f,"Pervasive systems over the years continuous to grow exponentially. Engagement of IoT in fields such as Agriculture, Home automation, industrial applications etc is on the rise. Self organizing networks within the IoT field give rise to engagement of various nodes for data communication. The rise in Cyber-Attacks within IoT pose a lot of threat to these connected nodes and hence there is a need for data passing through nodes to be verified during communication. In this paper we proposed a nodal authentication approach in IoT using blockchain in securing the integrity of data passing through the nodes in IoT. In our work, we engaged the GOST algorithm in our approach. At the end, we achieved a nodal authentication and verification of the transmitted data. This makes it very difficult for an attacker to fake a node in the communication chain of the connected nodes. Data integrity was achieved in the nodes during the communication. © 2019 IEEE.",Blockchain; Cloud Computing; Cloud Security; GOST Algorithm; IoT,Asare:2019:1
Conference Proceedings,Maouriyan N.; Krishna A.G.A.,AQUACHAIN-Water Supply-Chain management using Distributed Ledger Technology,2019,"2019 Proceedings of the 3rd International Conference on Computing and Communications Technologies, ICCCT 2019",10.1109/ICCCT2.2019.8824945,https://www.scopus.com/inward/record.uri?eid=2-s2.0-85072825753&doi=10.1109%2fICCCT2.2019.8824945&partnerID=40&md5=8fd66850f2e37ffe27517fb6d13d9151,"Water shortage is fast becoming one of the biggest crises of this century. The recent, exponential rise in adoption of the most disparate Internet of Things (IoT) devices and technologies has reached also Water supply chains, drumming up substantial research and innovation interest towards developing reliable, auditable and transparent traceability systems. Current IoT-based traceability and provenance systems for water supply chains are built on top of centralized infrastructures and this leaves room for unsolved issues and major concerns, including data integrity, tampering and single points of failure. Blockchains, the distributed ledger technology underpinning cryptocurrencies such as Bitcoin, represent a new and innovative technological approach to realizing decentralized trustless systems. This will also eliminate corruption due to unmaintained record of sources. Indeed, the inherent properties of this digital technology provide fault-tolerance, immutability, transparency and full traceability of the stored transaction records, as well as coherent digital representations of physical assets and autonomous transaction executions. This paper presents Aqua-chain, a fully decentralized, blockchain-based traceability solution for Water supply chain management, able to seamless integrate IoT devices producing and consuming digital data along the chain. To effectively assess Aqua-chain, first, we defined a classical use-case within the given vertical domain, namely from-supplier-to-buyer. Then, we developed and deployed such use-case, achieving traceability using blockchain implementation, Ethereum. Finally, we evaluated and compared the performance deployments, in terms of latency, CPU, and network usage, also highlighting its main pros and cons. © 2019 IEEE.",Blockchain; Distributed Ledger Technology(DLT); Economy; Government; Health; IoT; Water,Maouriyan:2019:1
Article,Maiti A.; Raza A.; Kang B.H.; Hardy L.,Estimating service quality in industrial internet-of-things monitoring applications with blockchain,2019,IEEE Access,10.1109/ACCESS.2019.2948269,https://www.scopus.com/inward/record.uri?eid=2-s2.0-85074640851&doi=10.1109%2fACCESS.2019.2948269&partnerID=40&md5=a9289b3441e559018e700d493284a410,"Internet of Things (IoT) plays a big role in automating information generation and consumption in industrial monitoring applications. Blockchain can allow this information to be stored in a manner that is both accessible and reliable for the IoT devices to work with. Blockchain has the capability to collect data from IoT devices and store it in a distributed manner that prevents tampering with the data. This paper discusses the use of blockchain to calculate the Service Quality (SQ) in an Industrial IoT for monitoring application. The proposed framework looks at the blockchain as a finite number of fragmented pieces of data corresponding to a specific industrial process. The SQ is expressed as penalties which is the difference between the expected IoT sensor values and the actual sensor data in reported events from the IoT devices. It also moderates the penalty between similar industrial processes based on each other. The moderation allows better understanding of the system functions and identification of specific problems rather than simply recording the sensor data for a single process. Furthermore, this paper analyzes private blockchains for suitability in IIoT and summarizes some key challenges for IoT to be used with blockchain in context of the proposed framework. The paper uses supply chain as a use case scenario for describing the proposed framework and presents results on its technical feasibility. © 2013 IEEE.",Blockchain; cyber-physical systems; internet of things; logistics; p2p network; smart contract,Maiti:2019:1
Conference Proceedings,Ali J.; Ali T.; Alsaawy Y.; Khalid A.S.; Musa S.,Blockchain-based smart-IoT trust zone measurement architecture,2019,ACM International Conference Proceeding Series,10.1145/3312614.3312646,https://www.scopus.com/inward/record.uri?eid=2-s2.0-85066796089&doi=10.1145%2f3312614.3312646&partnerID=40&md5=65a5f63b3a0b6b9d152cd4a20b7804d5,"With a rapid growth in the IT industry, Internet of Things (IoT) has gained a tremendous attention and become a central aspect of our environment. In IoT the things (devices) communicate and exchange the data without the act of human intervention. Such autonomy and proliferation of IoT ecosystem make the devices more vulnerable to attacks. In this paper, we propose a behavior monitor in IoTBlockchain setup which can provide trust-confidence to outside networks. Behavior monitor extracts the activity of each device and analyzes the behavior using deep auto-encoders. In addition, we also incorporate Trusted Execution Technology (Intel SGX) in order to provide a secure execution environment for applications and data on blockchain. Finally, in evaluation we analyze three IoT devices data that is infected by mirai attack. The evaluation results demonstrate the ability of our proposed method in terms of accuracy and time required for detection. © 2019 Association for Computing Machinery.",Behavior; Blockchain; Deep Learning; IoT; Security; Trust,Ali:2019:1
Article,Ding S.; Cao J.; Li C.; Fan K.; Li H.,A Novel Attribute-Based Access Control Scheme Using Blockchain for IoT,2019,IEEE Access,10.1109/ACCESS.2019.2905846,https://www.scopus.com/inward/record.uri?eid=2-s2.0-85065174375&doi=10.1109%2fACCESS.2019.2905846&partnerID=40&md5=eeb7774855a3ccccfa36268f7d928a52,"With the sharp increase in the number of intelligent devices, the Internet of Things (IoT) has gained more and more attention and rapid development in recent years. It effectively integrates the physical world with the Internet over existing network infrastructure to facilitate sharing data among intelligent devices. However, its complex and large-scale network structure brings new security risks and challenges to IoT systems. To ensure the security of data, traditional access control technologies are not suitable to be directly used for implementing access control in IoT systems because of their complicated access management and the lack of credibility due to centralization. In this paper, we proposed a novel attribute-based access control scheme for IoT systems, which simplifies greatly the access management. We use blockchain technology to record the distribution of attributes in order to avoid single point failure and data tampering. The access control process has also been optimized to meet the need for high efficiency and lightweight calculation for IoT devices. The security and performance analysis show that our scheme could effectively resist multiple attacks and be efficiently implemented in IoT systems. © 2013 IEEE.",Access control; attribute-based access control; blockchain; consortium blockchain; Internet of Things,Ding:2019:1
Article,Chanson M.; Bogner A.; Bilgeri D.; Fleisch E.; Wortmann F.,Blockchain for the IoT: Privacy-preserving protection of sensor data,2019,Journal of the Association for Information Systems,10.17705/1jais.00567,https://www.scopus.com/inward/record.uri?eid=2-s2.0-85073724986&doi=10.17705%2f1jais.00567&partnerID=40&md5=d8702772d8b5152408d35ca0c01fadc3,"An ever growing variety of smart, connected Internet of Things (IoT) devices poses completely new challenges for businesses regarding security and privacy. In fact, the adoption of smart products may depend on the ability of organizations to offer systems that ensure adequate sensor data integrity while guaranteeing sufficient user privacy. In light of these challenges, previous research indicates that blockchain technology could be a promising means to mitigate issues of data security arising in the IoT. Building upon the existing body of knowledge, we propose a design theory, including requirements, design principles, and features, for a blockchain-based sensor data protection system (SDPS) that leverages data certification. To support this, we designed and developed an instantiation of an SDPS (CertifiCar) in three iterative cycles intented to prevent the fraudulent manipulation of car mileage data. Following the explication of our SDPS, we provide an ex post evaluation of our design theory considering CertifiCar and two additional use cases in the areas of pharmaceutical supply chains and energy microgrids. Our results suggest that the proposed design ensures the tamper-resistant gathering, processing, and exchange of IoT sensor data in a privacy-preserving, scalable, and efficient manner. © 2019 by the Association for Information Systems.",Big data; Blockchain; Design science research; Design theory; Internet of things; Privacy; Security,Chanson:2019:1
